issuekey,title,description,storypoint
STUDIO-3651,query builder ability browse select single fields inside pojo,user able select individual fields pojo fields query builder resulting select pojonamefieldname type also user able select whole pojo resulting select pojoname type,5
STUDIO-3654,configurationexception thrown selecting watermark poll,selecting watermark poll processing strategy flow must sync isnt keeps throwing configuration exception solution set flow sync watermark option selected,5
STUDIO-3656,add support studio allow contribution external folders export import wizards,days import export wizards jobs manage mule projects folders thats static folders mule project studio developer would like possibility contribute folders srcmainapi folder project structure external plugin folders included project imported exported,5
STUDIO-3662,importing project zip choosing esb runtime different one project runtime inconsistent,steps reproduce create project runtime export deployable archive import back using runtime project ends esb runtime name jars,2
STUDIO-3667,create new project template lets create empty project without ends wizard,open new project wizard filenew new mule project write project name description select create project based existing template checkbox change selected runtime template selection lost wizard lets finish next without template selected generates valid empty project without configurations,3
STUDIO-3668,apikit generate flows option improvements,generate flows option apikit studio appear option top level project folder well individual raml files top level project folder selected raml files project flows generated furthermore option appear within apikit submenu standalone option within main selection menu,5
STUDIO-3669,prepopulate options apikit router single option exists,studio designer configuring apikit router studio wizard would like fields method flow resource may apply prepopulated value single possible value exists,3
STUDIO-3671,service autodiscovery icon name studio,name global element service discovery service autodiscovery new icon represents asr service component,1
STUDIO-3676,return type native queries lost project reloaded,return type native queries lost project reloaded cache information stored though,5
STUDIO-3695,removing sap libraries update muleprojectxml development environment running eclipse,removing sap libraries update muleprojectxml development environment running eclipse caused difference bundles present framework part project run works well built studio,3
STUDIO-3710,use selected connectors jars connectivity testing datasense,use selected connectors jars connectivity testing datasense today connectors added service classpath leading potential jar version clashes incompatibilities example add salesforce libraries classpath testing connectivity using datasense,8
STUDIO-3782,studio allows create new project one already present name,creating new mule project studio allows use name another project already present disk workspace steps reproduce create new mule project call myproject delete project workspace remove projects contents disk attempt create new project name mule least let know another project name already present workspace,3
STUDIO-3797,runtime classloader order onprem esb,rigth order create server classloader order esb currently pluginxml file runtimes look like code classpath labelresources directory pathmuledatamapper classpath libraryfolder includeincontainerfalse labeltooling support pathmuletooling populatecontentsinmavenrepofalse libraryfolder libraryfolder includeincontainertrue labelboot libraries pathmuleboot populatecontentsinmavenrepotrue inclusion regexjar inclusion exclusion regexlicmstudiojar exclusion libraryfolder libraryfolder includeincontainertrue labelendorsed libraries pathmuleendorsed populatecontentsinmavenrepofalse libraryfolder libraryfolder includeincontainertrue labelmule core libraries pathmulemule populatecontentsinmavenrepotrue exclusion regexmuleeeparentpoms exclusion exclusion regexmulelocalinstalljar exclusion inclusion regexmulejar inclusion libraryfolder libraryfolder includeincontainertrue labeloptional libraries pathmuleopt populatecontentsinmavenrepotrue inclusion regexjar inclusion libraryfolder libraryfolder includeincontainertrue labeluser pathmuleuser populatecontentsinmavenrepotrue inclusion regexmuletestsfunctionaljar inclusion libraryfolder libraryfolder includeincontainertrue labelmule core libraries per app pathmulemuleperapp populatecontentsinmavenrepotrue inclusion regexmulejar inclusion libraryfolder libraryfolder includeincontainerfalse labelmule addons pathmuleaddons populatecontentsinmavenrepotrue inclusion regex inclusion libraryfolder code need order correctly first need analyze whats correct order,5
STUDIO-3815,improve dialog attempting relaunch currently running mule application,user mule app running attempt start app dialog pops warning running instance embedded mule esb runtime provides information shutdown currenlty running server propose redeploy project,3
STUDIO-3818,new default debugging perspective,improvement debugging perspective like java debugging gives visibility console debugging flow different files time much better poll debugging,5
STUDIO-3832,bug datamapper process csv headers lower characters,generates metadata process headers lenght,5
STUDIO-3834,controlled error policy raised classcastexception try load mapping properties,mapping edit input properties change error policy controlled assign max errors number save try load properties throw exception,5
STUDIO-3835,analyze top level element changesrefactor support batch,need evaluate come decision whether refactoring top level elements adding batch top right creating new support top level elements implement batch new model,5
STUDIO-3836,mule esb threads always stopped,notification server always goes require changes esb code,5
STUDIO-3839,create jubula plugin support new property editors,need add functionality able test new editors acceptance criteria running current test suite new plugin,13
STUDIO-3843,integrate mock connector studio build,add mock connector studio build,3
STUDIO-3844,fix flaky importexport tests,fix existing tests add,5
STUDIO-3845,twoway editing tests transports,create way editing automated tests transports,5
STUDIO-3846,define user experience changing runtime downgradeupgrade connectors,offer user chance change connectors changes runtime,2
STUDIO-3847,batch module mockups,close batch mockups,3
STUDIO-3852,property editor open new components dropped workspace,user drops new component workspace properties editor automatically open new component,5
STUDIO-3857,improve locking datasense caches,improve locking datasense caches order reduce locking accesses cache,8
STUDIO-3858,add timeout datasense related connection threads,add timeout datasense related connection threads add preference panel allow configuration value set default seconds set time limit,8
STUDIO-3859,enable datasense connector option taken account file containing connector saved,file containing connector enable datasense option set true saved option taken account static metadata used,3
STUDIO-3867,doc name displayed cases,using message flow view developing studio cannot see doc name ive set example code snippet codexml objectstoreretrieve configrefobjectstore keystringsessionvarstenantidpollingstatus defaultvaluerefstringidle docnameretrieve polling status code processor shows objectstoreretrieve check image attached details,5
STUDIO-3877,migrate datamapper performance improvements mule,merge performance improvements mule,5
STUDIO-3879,analyze autocompletion elements text boxes,analyze take implement studio,13
STUDIO-3880,allow disabling stats collections studio preferences,studio starts sends message indicating users able disable behavior,2
STUDIO-3881,repair jubula sanity tests endpoint tests,repair jubula sanity tests endpoint tests,5
STUDIO-3882,create jubula automated tests services essential training labs,create jubula automated tests services essential training labs,13
STUDIO-3883,new project dialog mockups,overhaul new project dialog improve also impact studio examples,2
STUDIO-3884,palette simplification connectorendpoint simplification,brainstorm propose ways simplify current connectorcloudconnectorendpoints framework,5
STUDIO-3885,clean help menu contextual help,clean help menu tidy contextual help,3
STUDIO-3888,make mule examples compatible version control aka remove zips,remove zips make work,8
STUDIO-3889,batch,implement batch,13
STUDIO-3890,xml autocompletion batch xml component,add xml autocompletion support batch,5
STUDIO-3899,add support examples,add support compatible examples make work,5
STUDIO-3917,improve mel parser,improve mel parser recognize fields method calls parameters keywords regions order improve proposals,8
STUDIO-3922,create mule runtime plugin,runtime changes improve classpath issues,3
STUDIO-3924,schema validation filter missing two attributes,filter missing following two attributes errorhandlerref resourceresolverref xsd follow code xsdattribute nameresourceresolverref typexsdstring xsdannotation xsddocumentation reference spring bean implements codeorgwcdomlslsresourceresolvercode xsddocumentation xsdannotation xsdattribute xsdattribute nameerrorhandlerref typexsdstring xsdannotation xsddocumentation reference spring bean implements codeorgxmlsaxerrorhandlercode xsddocumentation xsdannotation xsdattribute code,1
STUDIO-3929,improve new project creation process,improve new project creation experience changing new mule project wizard scope changes includes consolidating wizard steps one easy screen excluding java project dialogs removing example projects improve deployment runtime selection default hide maven specification,3
STUDIO-3930,add new mule project example wizard,mule example projects removed new mule project wizard need find new home become new mule project example option new wizard mule folder see mockups clarification entails building new wizard populated example project properties,3
STUDIO-3939,opening project project explorer immediately expands folders expose flow files,user double clicks closed project package explorer project expand allow user immediately open flow file currently user must expand project expand flows file,3
STUDIO-3940,npe preview panel mapping xml fails,create mapping something xml fail reason,3
STUDIO-3941,json object transformer return type main page,working json object transformer finding useful return class place doesnt make seem weird mapper reference think might want separate tab people want use imho return type lot less advanced mapper reference,8
STUDIO-3942,change name batch containers input oncomplete,new containers names input oncomplete also accept record attribute step updated see,3
STUDIO-3943,integrate batch debugger,studio user want debug inside batch components,8
STUDIO-3944,add basic datasense propagation batch,datasense propagation inside batch components basic propagation treat different batch components single flow payload batch step element list last block input section payload batch aggregate section list preceeding component payload oncomplete section batchjobresult,5
STUDIO-3945,add support batch aggregator,studio user want use batch aggregator element,2
STUDIO-3946,add support batch message sources,studio user want able configure batch message sources currently oneway inbound endpoints supported,5
STUDIO-3947,batch steps allowed inside batch process scope,today validation batch steps added multiple places also checked dragdrop,2
STUDIO-3948,dragging batch job canvas prepopulate step,dragging batch job canvas prepopulate step improve usability,1
STUDIO-3949,create step container component drag droped inside batch process scope,create step container component drag droped inside batch process scope,2
STUDIO-3950,threading profile batch,user want configure threading profile batch code todo paste xml snippet code,1
STUDIO-3952,datasense integration autocompletion,auto completion engine able offer datasense information,5
STUDIO-3956,changing runtime usability improvements,user like changing runtime offer better options automatically upgrade connectors,3
STUDIO-3967,add set record variable component,add set record variable component,3
STUDIO-3968,add support new datasense failure types,better user feedback add two new failure types common lib use studio unknownmetadatakey provided metadata key invalid inexistant nodatasenseavailable datasense cannot retrieved supported specific configuration example oauth sap xml version,5
STUDIO-3970,create automatic backup jubula database amazon,jubula automated tests saved database local sever create backup job,3
STUDIO-3972,change cloudhub runtime name cloudhub mule runtime dec,change server label new release,1
STUDIO-3973,improvements connections explorer view,improvements made place toolbar right search filter align viewers closer filter toolbar change background color toolbar filters parent look well windows change margins widgets,2
STUDIO-4000,upgrade sap connector,upgrade sap connector,3
STUDIO-4031,add support new watermark attributes,add support new attributes defined mule,2
STUDIO-4062,studio changes required asr rebranding,modify agent configuration screens instances anypoint service registry changed anypoint platform need change default url host agentregistrymulesoftcom anypointagentmulesoftcom modify anypoint service registry components name service lookup within studio pallette note created equivalent studio story could rank,2
STUDIO-4044,input process records oncomplete section vertically aligned,would look lot cleaner elements input process records oncomplete section vertically aligned see screenshot,5
STUDIO-4051,core studio remove duplicate elements corexml,many duplicate elements corexml duplicate entry detected please remove duplicate entry detected please remove duplicate entry detected please remove duplicate entry detected please remove duplicate global entry detected please remove duplicate entry detected please remove duplicate entry detected please remove duplicate entry detected please remove duplicate entry detected please remove duplicate entry detected please remove duplicate entry detected please remove duplicate entry detected please remove duplicate global entry detected please remove duplicate global entry detected please remove duplicate global entry detected please remove duplicate global entry detected please remove duplicate global entry detected please remove duplicate global entry detected please remove many nested elements related objectstore please remove test everything keeps working fine remove test,5
STUDIO-4059,replace batch icons final ones,replace batch icons final ones provided james hall,2
STUDIO-4076,server definitions dont accept two localids different versions,right server loads definitions filters element retrieved definition creating server definition need add elements related particular server version allow two localids different servers different behavior,5
STUDIO-4079,element multi transaction allowed child element,multitransaction support endpoints added mule esb version nesting eemultitransaction element inside inbound outbound endpoint studio marks element wrong message colorredelement multi transaction allowed child element vmcolor,8
STUDIO-4134,datamapper improve user generated csv window,please see attached mockups,1
STUDIO-4137,adjust field truncation default rule expression checkboxes,checkboxes appear mutually exclusive dont act way please see attached mockup guidance implementation ping questions,5
STUDIO-4172,problem undo,steps reproduce create project flows select flows delete cmd issue get followed exception code javalangindexoutofboundsexception index size javautilarraylistaddarraylistjava orgeclipsegefeditpartsabstracteditpartreorderchildabstracteditpartjava orgeclipsegefeditpartsabstractgraphicaleditpartreorderchildabstractgraphicaleditpartjava orgeclipsegefeditpartsabstracteditpartrefreshchildrenabstracteditpartjava orgmuletoolingmessagefloweditpartmuleconfigurationeditpartupdatemuleconfigurationeditpartjava javautilobservablenotifyobserversobservablejava orgmuletoolingmodelmessageflowdecoratorentitydecoratorfireevententitydecoratorjava orgmuletoolingmodelmessageflowdecoratormuleconfigurationdecoratoraddflowmuleconfigurationdecoratorjava orgmuletoolingmessageflowcommanddeleteflowcommandundodeleteflowcommandjava orgeclipsegefcommandscompoundcommandundocompoundcommandjava orgeclipsegefcommandscompoundcommandundocompoundcommandjava orgeclipsegefcommandscommandstackundocommandstackjava orgeclipsegefuiactionsundoactionrunundoactionjava orgeclipsejfaceactionactionrunwitheventactionjava orgeclipseuiactionsretargetactionrunwitheventretargetactionjava orgeclipsejfacecommandsactionhandlerexecuteactionhandlerjava orgeclipsecorecommandscommandexecutewithcheckscommandjava orgeclipsecorecommandsparameterizedcommandexecutewithchecksparameterizedcommandjava orgeclipseuiinternalhandlershandlerserviceexecutecommandhandlerservicejava orgeclipseuiinternalkeysworkbenchkeyboardexecutecommandworkbenchkeyboardjava orgeclipseuiinternalkeysworkbenchkeyboardpressworkbenchkeyboardjava orgeclipseuiinternalkeysworkbenchkeyboardprocesskeyeventworkbenchkeyboardjava orgeclipseuiinternalkeysworkbenchkeyboardfilterkeysequencebindingsworkbenchkeyboardjava orgeclipseuiinternalkeysworkbenchkeyboardaccessworkbenchkeyboardjava orgeclipseuiinternalkeysworkbenchkeyboardkeydownfilterhandleeventworkbenchkeyboardjava orgeclipseswtwidgetseventtablesendeventeventtablejava orgeclipseswtwidgetsdisplayfiltereventdisplayjava orgeclipseswtwidgetsdisplaysendeventdisplayjava orgeclipseswtwidgetswidgetsendeventwidgetjava orgeclipseswtwidgetswidgetsendeventwidgetjava orgeclipseswtwidgetswidgetsendeventwidgetjava orgeclipseswtwidgetswidgetsendkeyeventwidgetjava orgeclipseswtwidgetswidgetsendkeyeventwidgetjava orgeclipseswtwidgetscanvassendkeyeventcanvasjava orgeclipseswtwidgetscontroldocommandbyselectorcontroljava orgeclipseswtwidgetsdisplaywindowprocdisplayjava orgeclipseswtinternalcocoaosobjcmsgsendnative method orgeclipseswtinternalcocoansresponderinterpretkeyeventsnsresponderjava orgeclipseswtwidgetscompositekeydowncompositejava orgeclipseswtwidgetsdisplaywindowprocdisplayjava orgeclipseswtinternalcocoaosobjcmsgsendsupernative method orgeclipseswtwidgetswidgetcallsuperwidgetjava orgeclipseswtwidgetswidgetwindowsendeventwidgetjava orgeclipseswtwidgetsshellwindowsendeventshelljava orgeclipseswtwidgetsdisplaywindowprocdisplayjava orgeclipseswtinternalcocoaosobjcmsgsendsupernative method orgeclipseswtwidgetsdisplayapplicationsendeventdisplayjava orgeclipseswtwidgetsdisplayapplicationprocdisplayjava orgeclipseswtinternalcocoaosobjcmsgsendnative method orgeclipseswtinternalcocoansapplicationsendeventnsapplicationjava orgeclipseswtwidgetsdisplayreadanddispatchdisplayjava orgeclipseuiinternalworkbenchruneventloopworkbenchjava orgeclipseuiinternalworkbenchrunuiworkbenchjava orgeclipseuiinternalworkbenchaccessworkbenchjava orgeclipseuiinternalworkbenchrunworkbenchjava orgeclipsecoredatabindingobservablerealmrunwithdefaultrealmjava orgeclipseuiinternalworkbenchcreateandrunworkbenchworkbenchjava orgeclipseuiplatformuicreateandrunworkbenchplatformuijava orgeclipseuiinternalideapplicationideapplicationstartideapplicationjava orgeclipseequinoxinternalappeclipseapphandleruneclipseapphandlejava orgeclipsecoreruntimeinternaladaptoreclipseapplauncherrunapplicationeclipseapplauncherjava orgeclipsecoreruntimeinternaladaptoreclipseapplauncherstarteclipseapplauncherjava orgeclipsecoreruntimeadaptoreclipsestarterruneclipsestarterjava orgeclipsecoreruntimeadaptoreclipsestarterruneclipsestarterjava sunreflectnativemethodaccessorimplinvokenative method sunreflectnativemethodaccessorimplinvokenativemethodaccessorimpljava sunreflectdelegatingmethodaccessorimplinvokedelegatingmethodaccessorimpljava javalangreflectmethodinvokemethodjava orgeclipseequinoxlaunchermaininvokeframeworkmainjava orgeclipseequinoxlaunchermainbasicrunmainjava orgeclipseequinoxlaunchermainrunmainjava code,5
STUDIO-4191,typo datamapper error message,please fix required typo datamapper error list window see attached screenshot location,1
STUDIO-4192,cloud connector deselect default operations,default every cloud connector operation selected often presents errors users configure operation users frequently get distracted errors causes friction please set default operation simple grey message please select operation hide operation info user selected operation mockups,13
STUDIO-4197,datamapper capitalize file name,capitalize file name first screen datamapper see attached screenshot,1
STUDIO-4207,propagation rules properties,studio user want message properties payload propagated flow,5
STUDIO-4208,datasense support message properties,datasense model extended support metadata message properties variables today support payload,5
STUDIO-4209,datasense support enrichers,studio user like enricher changing datasense model need define rules expressions target level parsed determine destination metadata type,5
STUDIO-4211,onunaccepted available idempotentmessagefilter studio,support onunaccepted idempotentmessagefilter added mule however attribute show component properties editing idempotentmessagefilter mulestudio neither show auto completion however follwoing still valid code works expected executed code idempotentmessagefilter onunaccepteddlqflow storeprefixtest idexpressionpayload docnameidempotent message code,5
STUDIO-4215,define mvp mule labs,define mvp mule labs,3
STUDIO-4216,design web services consumer,requires defining stories dependencies close mvp create mockups,5
STUDIO-4217,create web services consumer editor,user like configure web services component studio able discover wsdl filesystem able type url wsdl able choose service port operation based wsdl rather type service address automatically populated based port chosen clearly see errors caused invalid wsdl wsdl found,8
STUDIO-4227,datamapper deleting filter visual map leaves folder collapsed,issue datamappers filtering steps recreate set mapping doesnt matter youre mapping start typing filter either input output doesnt matter ensure filter result delete filter notice folders still collapsed would ideal folders expanded deleting filter,5
STUDIO-4230,file endpoint change output pattern field title,number users experienced friction understanding specify file name outbound endpoint dont understand output pattern valid location specify name propose change title new file name anticipate suggestion best option want throw get dialog started please feel participate conversation comments,2
STUDIO-4240,support synchronous untilsuccessful,dolomite untilsuccessful component enhanced synchronous mode enhance componen synchronous attribute defaults false optional threadingprofile element,5
STUDIO-4242,change operation salesforce connector change correctly parameter,using sfdc connector using query operation datasense choosing datasense query language everything works fine change operation query query single previously save use operation query parameter operation name query starts dsql leave like query single operation receives parameters fail understand prepended dsql please check attached immages,13
STUDIO-4243,anypoint studio design new splash screen,james work chris payne get new anypoint studio splash screen designed,5
STUDIO-4245,support new scattergather component,add support scattergather component defined mule support child elements attributes scattergather work debugger metadata propagate left right scattergather metadata unknown scattergather follow mockups,5
STUDIO-4246,support root abstract types,root type abstract type user input implementation type want use,8
STUDIO-4248,support abstract types dynamically,abstract types user may want create different implementation based input type implementation picked runtime implementation support xsitype overriding substitution groups user able click element change type presented list derivative types choose,8
STUDIO-4250,add missing attributes socketmaxwait connectiontimeout tcp connector,tcp connector add attributes socketmaxwait since code xsdattribute namesocketmaxwait typemulesubstitutableint xsdannotation xsddocumentation sets maximum amount time milliseconds socket pool block waiting socket throwing exception less equal may block indefinitely default xsddocumentation xsdannotation xsdattribute code connectiontimeout since code xsdattribute nameconnectiontimeout typemulesubstitutableint xsdannotation xsddocumentation number milliseconds wait outbound connection remote server successfully created timeout configured default xsddocumentation xsdannotation xsdattribute code,3
STUDIO-4252,rename mule studio anypoint studio,rename mule studio anypoint studio screen artifact names default installation location application name mac menu bar splash screen also find replace text occurrences mule studio,5
STUDIO-4259,use dot notation properties mel autocomplete,upcoming changes mel use dot notation everywhere,5
STUDIO-4260,adding autocompletion support properties propagation,add autocompletion support flowvars sessionvars inbound outbound properties supporting propagation changes,5
STUDIO-4263,repackage new mvel libraries,update mvel branch latest mvel changes,2
STUDIO-4265,web services create new icon,design web services icon palette canvas,5
STUDIO-4282,create update editor,create update editor,2
STUDIO-4283,create delete editor,create delete editor,2
STUDIO-4294,must able discover wsdl filesystem,must able discover wsdl filesystem consumer find service metadata,3
STUDIO-4296,must able type url wsdl,must able type url wsdl consumer find service metadata,3
STUDIO-4298,add metadata support insert,add metadata support insert,2
STUDIO-4299,add metadata support update,add metadata support update,2
STUDIO-4301,add metadata support delete,add metadata support delete,2
