issuekey,title,description,storypoint
BAM-5287,name change build plan security aware broke nant plugin,error main defaultpluginmanager error loading descriptor view ncover result plugin comatlassianbamboopluginbuildernant disabling javalangnoclassdeffounderror comatlassianbamboowwawarepermissionsbuildreadsecurityaware javalangclassloaderdefineclassnative method javalangclassloaderdefineclassclassloaderjava javasecuritysecureclassloaderdefineclasssecureclassloaderjava orgapachecatalinaloaderwebappclassloaderfindclassinternalwebappclassloaderjava orgapachecatalinaloaderwebappclassloaderfindclasswebappclassloaderjava orgapachecatalinaloaderwebappclassloaderloadclasswebappclassloaderjava orgapachecatalinaloaderwebappclassloaderloadclasswebappclassloaderjava comopensymphonyutilclassloaderutilloadclassclassloaderutiljava comopensymphonyxworkobjectfactorygetclassinstanceobjectfactoryjava comopensymphonyxworkspringspringobjectfactorygetclassinstancespringobjectfactoryjava comopensymphonyxworkspringspringobjectfactorybuildbeanspringobjectfactoryjava comopensymphonyxworkobjectfactorybuildactionobjectfactoryjava comatlassianbamboopluginxworkpluginawareobjectfactorybuildactionpluginawareobjectfactoryjava comatlassianbamboopluginxworkxworkmoduledescriptoraddactionxworkmoduledescriptorjava comatlassianbamboopluginxworkxworkmoduledescriptorgetpackagesxworkmoduledescriptorjava comatlassianbamboopluginxworkxworkmoduledescriptorgetpackagesxworkmoduledescriptorjava comatlassianbamboopluginxworkxworkmoduledescriptorinitxworkmoduledescriptorjava comopensymphonyxworkconfigimpldefaultconfigurationreloaddefaultconfigurationjava comatlassianbamboopluginxworkxworkmoduledescriptorenabledxworkmoduledescriptorjava comatlassianpluginmanagerdefaultpluginmanagernotifymoduleenableddefaultpluginmanagerjava comatlassianpluginmanagerdefaultpluginmanagerenablepluginmodulesdefaultpluginmanagerjava comatlassianpluginmanagerdefaultpluginmanageraddpluginsdefaultpluginmanagerjava comatlassianpluginmanagerdefaultpluginmanagerinitdefaultpluginmanagerjava comatlassianbamboocontainerbamboocontainerinitbamboocontainerjava comatlassianbamboocontainerbamboocontainerinitialisebamboocontainerjava comatlassianbambooupgradeupgradelauncherinitialisebamboocontainerupgradelauncherjava comatlassianbambooupgradeupgradelauncherupgradeandstartbambooupgradelauncherjava comatlassianbambooupgradeupgradelaunchercontextinitializedupgradelauncherjava orgapachecatalinacorestandardcontextlistenerstartstandardcontextjava orgapachecatalinacorestandardcontextstartstandardcontextjava orgapachecatalinacorecontainerbaseaddchildinternalcontainerbasejava orgapachecatalinacorecontainerbaseaddchildcontainerbasejava orgapachecatalinacorestandardhostaddchildstandardhostjava orgapachecatalinastartuphostconfigdeploydirectoryhostconfigjava orgapachecatalinastartuphostconfigdeploydirectorieshostconfigjava orgapachecatalinastartuphostconfigdeployappshostconfigjava orgapachecatalinastartuphostconfigstarthostconfigjava orgapachecatalinastartuphostconfiglifecycleeventhostconfigjava orgapachecatalinautillifecyclesupportfirelifecycleeventlifecyclesupportjava orgapachecatalinacorecontainerbasestartcontainerbasejava orgapachecatalinacorestandardhoststartstandardhostjava orgapachecatalinacorecontainerbasestartcontainerbasejava orgapachecatalinacorestandardenginestartstandardenginejava orgapachecatalinacorestandardservicestartstandardservicejava orgapachecatalinacorestandardserverstartstandardserverjava orgapachecatalinastartupcatalinastartcatalinajava sunreflectnativemethodaccessorimplinvokenative method sunreflectnativemethodaccessorimplinvokenativemethodaccessorimpljava sunreflectdelegatingmethodaccessorimplinvokedelegatingmethodaccessorimpljava javalangreflectmethodinvokemethodjava orgapachecatalinastartupbootstrapstartbootstrapjava orgapachecatalinastartupbootstrapmainbootstrapjava,1
BAM-5296,differences implementation buildresultssummary cause labels duplicated related builds date tab jira bamboo plugin,see buildresultssummarydocument buildresultssummaryimpl getlabelnames,3
BAM-5317,delete multiple agents simultaneously,lab manager plugin pollutes agent space thousands agents deregister properly ruins performance affected product plans agent capabilities please implement way delete inactive agents,5
BAM-5328,large number exceptions thrown jbac,ssh atlassianprivate nice tail servicejeejirabambooatlassiancomlogmaincurrent sample bcebcb error tpprocessor runtime bcebc bcebcbc error executing macro displayreorderqueueactions bcebcf required parameter returnurl specified bcebcac problematic instruction bcebcaf bcebcaadc macro displayreorderqueueactions line column fragmentsshowbuildqueueftl bcebcbac userdirective displayreorderqueueactions line column fragmentsshowbuildqueueftl bcebcd bcebcd bcebcbc java backtrace programmers bcebcaa bcebcec freemarkertemplatetemplateexception error executing macro displayreorderqueueactions bcebcc required parameter returnurl specified bcebca freemarkercoremacrocontextsanitycheckmacrojava bcebcdcc freemarkercoremacrocontextrunmacromacrojava bcebcc freemarkercoreenvironmentvisitenvironmentjava bcebc freemarkercoreunifiedcallacceptunifiedcalljava bcebcdc freemarkercoreenvironmentvisitenvironmentjava bcebc freemarkercoreconditionalblockacceptconditionalblockjava bcebcadc freemarkercoreenvironmentvisitenvironmentjava bcebcac freemarkercoremixedcontentacceptmixedcontentjava bcebcdbc freemarkercoreenvironmentvisitenvironmentjava bcebcda freemarkercoreifblockacceptifblockjava bcebcdf freemarkercoreenvironmentvisitenvironmentjava bcebcec freemarkercoreiteratorblockcontextrunloopiteratorblockjava bcebce freemarkercoreenvironmentvisitenvironmentjava bcebcfacc freemarkercoreiteratorblockacceptiteratorblockjava bcebcfeb freemarkercoreenvironmentvisitenvironmentjava bcebc freemarkercoreifblockacceptifblockjava bcebcac freemarkercoreenvironmentvisitenvironmentjava bcebce freemarkercoremixedcontentacceptmixedcontentjava bcebcdc freemarkercoreenvironmentvisitenvironmentjava bcebcc freemarkercoreenvironmentprocessenvironmentjava bcebcac freemarkertemplatetemplateprocesstemplatejava bcebcc comopensymphonywebworkviewsfreemarkerfreemarkerresultdoexecutefreemarkerresultjava bcebc comopensymphonywebworkdispatcherwebworkresultsupportexecutewebworkresultsupportjava bcebccc comopensymphonyxworkdefaultactioninvocationexecuteresultdefaultactioninvocationjava bcebcc comopensymphonyxworkdefaultactioninvocationinvokedefaultactioninvocationjava bcebcbdc comopensymphonyxworkinterceptordefaultworkflowinterceptordointerceptdefaultworkflowinterceptorjava bcebcac comatlassianbamboowwinterceptorsbambooworkflowinterceptordointerceptbambooworkflowinterceptorjava bcebc comopensymphonyxworkinterceptormethodfilterinterceptorinterceptmethodfilterinterceptorjava bcebcf comopensymphonyxworkdefaultactioninvocationinvokedefaultactioninvocationjava bcebcec comopensymphonyxworkvalidatorvalidationinterceptordointerceptvalidationinterceptorjava bcebcac comatlassianbamboowwinterceptorsbamboovalidationinterceptordointerceptbamboovalidationinterceptorjava bcebcc comopensymphonyxworkinterceptormethodfilterinterceptorinterceptmethodfilterinterceptorjava bcebcfc comopensymphonyxworkdefaultactioninvocationinvokedefaultactioninvocationjava bcebcd comatlassianbamboowwinterceptorsjsonvalidationinterceptorinterceptjsonvalidationinterceptorjava bcebcf comopensymphonyxworkdefaultactioninvocationinvokedefaultactioninvocationjava bcebccc comopensymphonyxworkinterceptoraroundinterceptorinterceptaroundinterceptorjava bcebcaac comopensymphonyxworkdefaultactioninvocationinvokedefaultactioninvocationjava bcebcbc comopensymphonyxworkinterceptoraroundinterceptorinterceptaroundinterceptorjava bcebccd comopensymphonyxworkdefaultactioninvocationinvokedefaultactioninvocationjava bcebccbc comopensymphonyxworkinterceptoraroundinterceptorinterceptaroundinterceptorjava bcebccfc comopensymphonyxworkdefaultactioninvocationinvokedefaultactioninvocationjava bcebce comopensymphonywebworkinterceptorfileuploadinterceptorinterceptfileuploadinterceptorjava bcebceae comopensymphonyxworkdefaultactioninvocationinvokedefaultactioninvocationjava bcebceecc comopensymphonyxworkinterceptoraroundinterceptorinterceptaroundinterceptorjava bcebcdc comopensymphonyxworkdefaultactioninvocationinvokedefaultactioninvocationjava bcebcdac comopensymphonyxworkinterceptoraroundinterceptorinterceptaroundinterceptorjava bcebc comopensymphonyxworkdefaultactioninvocationinvokedefaultactioninvocationjava bcebc comopensymphonyxworkinterceptoraroundinterceptorinterceptaroundinterceptorjava bcebcd comopensymphonyxworkdefaultactioninvocationinvokedefaultactioninvocationjava bcebcbc comopensymphonyxworkinterceptorininterceptorinterceptininterceptorjava bcebccc comopensymphonyxworkdefaultactioninvocationinvokedefaultactioninvocationjava bcebc comopensymphonyxworkinterceptoraroundinterceptorinterceptaroundinterceptorjava bcebcbcc comopensymphonyxworkdefaultactioninvocationinvokedefaultactioninvocationjava bcebcfb comatlassianbamboosecurityacegiinterceptwebwebworksecurityinterceptorinterceptwebworksecurityinterceptorjava bcebc comatlassianbamboosecurityacegiinterceptwebwebworksecurityinterceptorproxyinterceptwebworksecurityinterceptorproxyjava bcebcee comopensymphonyxworkdefaultactioninvocationinvokedefaultactioninvocationjava bcebcecb comatlassianbamboowwinterceptorspaginationawareinterceptorinterceptpaginationawareinterceptorjava bcebcfc comopensymphonyxworkdefaultactioninvocationinvokedefaultactioninvocationjava bcebcafdc comatlassianbamboowwinterceptorsstatisticsawareinterceptorinterceptstatisticsawareinterceptorjava bcebcaac comopensymphonyxworkdefaultactioninvocationinvokedefaultactioninvocationjava bcebcab comatlassianbamboowwinterceptorsresultslistawareinterceptorinterceptresultslistawareinterceptorjava bcebca comopensymphonyxworkdefaultactioninvocationinvokedefaultactioninvocationjava bcebcaec comatlassianbamboowwinterceptorstestcaseawareinterceptorintercepttestcaseawareinterceptorjava bcebcaebc comopensymphonyxworkdefaultactioninvocationinvokedefaultactioninvocationjava bcebcae comatlassianbamboowwinterceptorsbuildresultssummaryawareinteceptorinterceptbuildresultssummaryawareinteceptorjava bcebcab comopensymphonyxworkdefaultactioninvocationinvokedefaultactioninvocationjava bcebcadc comatlassianbamboowwinterceptorsbuildawareinterceptorinterceptbuildawareinterceptorjava bcebca comopensymphonyxworkdefaultactioninvocationinvokedefaultactioninvocationjava bcebcaf comopensymphonyxworkinterceptoraroundinterceptorinterceptaroundinterceptorjava bcebcacdc comopensymphonyxworkdefaultactioninvocationinvokedefaultactioninvocationjava bcebcaac comopensymphonyxworkinterceptoraroundinterceptorinterceptaroundinterceptorjava bcebcab comopensymphonyxworkdefaultactioninvocationinvokedefaultactioninvocationjava bcebcabec comopensymphonyxworkinterceptoraroundinterceptorinterceptaroundinterceptorjava bcebcabbbc comopensymphonyxworkdefaultactioninvocationinvokedefaultactioninvocationjava bcebcacc comopensymphonyxworkinterceptorexceptionmappinginterceptorinterceptexceptionmappinginterceptorjava bcebcaee comopensymphonyxworkdefaultactioninvocationinvokedefaultactioninvocationjava bcebcaf comopensymphonyxworkdefaultactionproxyexecutedefaultactionproxyjava bcebcafe comopensymphonywebworkdispatcherdispatcherutilsserviceactiondispatcherutilsjava bcebcbc comopensymphonywebworkdispatcherfilterdispatcherdofilterfilterdispatcherjava bcebcbc orgapachecatalinacoreapplicationfilterchaininternaldofilterapplicationfilterchainjava bcebcb orgapachecatalinacoreapplicationfilterchaindofilterapplicationfilterchainjava bcebcbd comatlassianpluginservletfilteriteratingfilterchaindofilteriteratingfilterchainjava bcebcbd comatlassianpluginservletfilterservletfiltermodulecontainerfilterdofilterservletfiltermodulecontainerfilterjava bcebcbc comatlassianpluginservletfilterservletfiltermodulecontainerfilterdofilterservletfiltermodulecontainerfilterjava bcebcb orgapachecatalinacoreapplicationfilterchaininternaldofilterapplicationfilterchainjava bcebcbfc orgapachecatalinacoreapplicationfilterchaindofilterapplicationfilterchainjava bcebcbdc comopensymphonymodulesitemeshfilterpagefilterparsepagepagefilterjava bcebcbac comopensymphonymodulesitemeshfilterpagefilterdofilterpagefilterjava bcebcb orgapachecatalinacoreapplicationfilterchaininternaldofilterapplicationfilterchainjava bcebcbf orgapachecatalinacoreapplicationfilterchaindofilterapplicationfilterchainjava bcebcbfff comopensymphonywebworkdispatcheractioncontextcleanupdofilteractioncontextcleanupjava bcebccc orgapachecatalinacoreapplicationfilterchaininternaldofilterapplicationfilterchainjava bcebccbac orgapachecatalinacoreapplicationfilterchaindofilterapplicationfilterchainjava bcebccf comatlassianpluginservletfilteriteratingfilterchaindofilteriteratingfilterchainjava bcebcc comatlassianpluginservletfilterservletfiltermodulecontainerfilterdofilterservletfiltermodulecontainerfilterjava bcebccac comatlassianpluginservletfilterservletfiltermodulecontainerfilterdofilterservletfiltermodulecontainerfilterjava bcebccfc orgapachecatalinacoreapplicationfilterchaininternaldofilterapplicationfilterchainjava bcebcccc orgapachecatalinacoreapplicationfilterchaindofilterapplicationfilterchainjava bcebccd comatlassianbamboofilteraccesslogfilterdofilteraccesslogfilterjava bcebcc orgapachecatalinacoreapplicationfilterchaininternaldofilterapplicationfilterchainjava bcebccc orgapachecatalinacoreapplicationfilterchaindofilterapplicationfilterchainjava bcebccdc orgacegisecurityutilfilterchainproxyvirtualfilterchaindofilterfilterchainproxyjava bcebcc orgacegisecurityprovidersanonymousanonymousprocessingfilterdofilteranonymousprocessingfilterjava bcebccc orgacegisecurityutilfilterchainproxyvirtualfilterchaindofilterfilterchainproxyjava bcebccac comatlassianbamboofilterseraphloginfilterdofilterseraphloginfilterjava bcebccc orgacegisecurityutilfilterchainproxyvirtualfilterchaindofilterfilterchainproxyjava bcebcccc orgacegisecurityutilfilterchainproxydofilterfilterchainproxyjava bcebcccefc orgacegisecurityutilfiltertobeanproxydofilterfiltertobeanproxyjava bcebccdcc comatlassianbamboofilterbambooacegiproxyfilterdofilterbambooacegiproxyfilterjava bcebccec orgapachecatalinacoreapplicationfilterchaininternaldofilterapplicationfilterchainjava bcebcceec orgapachecatalinacoreapplicationfilterchaindofilterapplicationfilterchainjava bcebccfc comatlassianbamboofilterlicensefilterdofilterlicensefilterjava bcebccff comatlassiancorefiltersabstract bcebcddc orgapachecatalinacoreapplicationfilterchaininternaldofilterapplicationfilterchainjava bcebcdc orgapachecatalinacoreapplicationfilterchaindofilterapplicationfilterchainjava bcebcd comatlassianjohnsonfiltersabstractjohnsonfilterdofilterabstractjohnsonfilterjava bcebcd orgapachecatalinacoreapplicationfilterchaininternaldofilterapplicationfilterchainjava bcebcdc orgapachecatalinacoreapplicationfilterchaindofilterapplicationfilterchainjava bcebcdbfc comatlassianseraphfiltersecurityfilterdofiltersecurityfilterjava bcebcdfe orgapachecatalinacoreapplicationfilterchaininternaldofilterapplicationfilterchainjava bcebcdabc orgapachecatalinacoreapplicationfilterchaindofilterapplicationfilterchainjava bcebcdbc comatlassianseraphfilterbaseloginfilterdofilterbaseloginfilterjava bcebcdb orgapachecatalinacoreapplicationfilterchaininternaldofilterapplicationfilterchainjava bcebcdbd orgapachecatalinacoreapplicationfilterchaindofilterapplicationfilterchainjava bcebcddcc comatlassianpluginservletfilteriteratingfilterchaindofilteriteratingfilterchainjava bcebcddc comatlassianpluginservletfilterdelegatingpluginfilterdofilterdelegatingpluginfilterjava bcebcdec comatlassianoauthserviceproviderinternalservletoauthfilterdofilteroauthfilterjava bcebce comatlassianpluginservletfilterdelegatingpluginfilterdofilterdelegatingpluginfilterjava bcebceb comatlassianpluginservletfilteriteratingfilterchaindofilteriteratingfilterchainjava bcebce comatlassianpluginservletfilterservletfiltermodulecontainerfilterdofilterservletfiltermodulecontainerfilterjava bcebcebc comatlassianpluginservletfilterservletfiltermodulecontainerfilterdofilterservletfiltermodulecontainerfilterjava bcebceec orgapachecatalinacoreapplicationfilterchaininternaldofilterapplicationfilterchainjava bcebce orgapachecatalinacoreapplicationfilterchaindofilterapplicationfilterchainjava bcebcefc orgspringframeworkormhibernatesupportopensessioninviewfilterdofilterinternalopensessioninviewfilterjava bcebcedcc comatlassianspringfilterflushingspringsessioninviewfilterdofilterinternalflushingspringsessioninviewfilterjava bcebcec orgspringframeworkwebfilteronceperrequestfilterdofilteronceperrequestfilterjava bcebcecac orgapachecatalinacoreapplicationfilterchaininternaldofilterapplicationfilterchainjava bcebce orgapachecatalinacoreapplicationfilterchaindofilterapplicationfilterchainjava bcebce complanetjservletfiltercompressioncompressingfilterhandledofiltercompressingfilterjava bcebce complanetjservletfiltercompressioncompressingfilterdofiltercompressingfilterjava bcebcefd comatlassianbamboofiltercompressingfilterdofiltercompressingfilterjava bcebceaa orgapachecatalinacoreapplicationfilterchaininternaldofilterapplicationfilterchainjava bcebceaf orgapachecatalinacoreapplicationfilterchaindofilterapplicationfilterchainjava bcebcebc comatlassianbamboofilternoncachingheaderfilterdofilternoncachingheaderfilterjava bcebcece orgapachecatalinacoreapplicationfilterchaininternaldofilterapplicationfilterchainjava bcebceceb orgapachecatalinacoreapplicationfilterchaindofilterapplicationfilterchainjava bcebced comatlassianbamboofilterrequestcachethreadlocalfilterdofilterrequestcachethreadlocalfilterjava bcebcefc orgapachecatalinacoreapplicationfilterchaininternaldofilterapplicationfilterchainjava bcebcefd orgapachecatalinacoreapplicationfilterchaindofilterapplicationfilterchainjava bcebcf comatlassianpluginservletfilteriteratingfilterchaindofilteriteratingfilterchainjava bcebcfc comatlassianpluginservletfilterservletfiltermodulecontainerfilterdofilterservletfiltermodulecontainerfilterjava bcebcf comatlassianpluginservletfilterservletfiltermodulecontainerfilterdofilterservletfiltermodulecontainerfilterjava bcebcfb orgapachecatalinacoreapplicationfilterchaininternaldofilterapplicationfilterchainjava bcebcf orgapachecatalinacoreapplicationfilterchaindofilterapplicationfilterchainjava bcebcfac orgspringframeworkwebfiltercharacterencodingfilterdofilterinternalcharacterencodingfilterjava bcebcfec orgspringframeworkwebfilteronceperrequestfilterdofilteronceperrequestfilterjava bcebcfaa orgapachecatalinacoreapplicationfilterchaininternaldofilterapplicationfilterchainjava bcebcfa orgapachecatalinacoreapplicationfilterchaindofilterapplicationfilterchainjava,1
BAM-5358,persist calculated data artifactlink,chai reason wouldnt simply store calculated values one things size calculated directories fear going expensive artifacts big thoughts krystian decide persist url shall remember update buildkey get changed build move opinion adds complexity however store path kind token replaced plankey property read browsesartifactsbuildwhatever want persist artifact size well might calculate directory size would done chai yeah url could store calculated suffix thing requires browse indexhtml etc leave prefix apended expensive store full size directory though itd good testing see much time adds say clover report jira good test,2
BAM-5376,dynamic agents,related bam,8
