issuekey,title,description,storypoint
BAM-65,allows cvs repo timeout report locking issues,sometimes perform cvs action get something like noformat cvs update waiting mchais lock cvsrootatlassianmaventestbamboo noformat bamboo would probably hang become happy allow bamboo timeout conditionally stop tell user dix problem,3
BAM-3476,result saved checkout fails,happened yesterday hosted bamboo bamboo upgraded build log messages like noformat jan build inttst started building agent default agent jan updating source code revision jan source found optjeedomainsbambooatlassiancomgdanskwebappsdatabambooattemptxmldatabuilddirinttst updating source jan optjeedomainsbambooatlassiancomgdanskwebappsdatabambooattemptxmldatabuilddirinttstsrctestjavacomatlassianthepluginidea jan optjeedomainsbambooatlassiancomgdanskwebappsdatabambooattemptxmldatabuilddirinttstsrctestjavacomatlassiantheplugin jan optjeedomainsbambooatlassiancomgdanskwebappsdatabambooattemptxmldatabuilddirinttstsrctestjavacomatlassian jan optjeedomainsbambooatlassiancomgdanskwebappsdatabambooattemptxmldatabuilddirinttstsrctestjavacom jan optjeedomainsbambooatlassiancomgdanskwebappsdatabambooattemptxmldatabuilddirinttstsrctestjava jan optjeedomainsbambooatlassiancomgdanskwebappsdatabambooattemptxmldatabuilddirinttstsrctest jan optjeedomainsbambooatlassiancomgdanskwebappsdatabambooattemptxmldatabuilddirinttstsrcmainjavacomatlassianthepluginideajira jan optjeedomainsbambooatlassiancomgdanskwebappsdatabambooattemptxmldatabuilddirinttstsrcmainjavacomatlassianthepluginideacrucibletree jan optjeedomainsbambooatlassiancomgdanskwebappsdatabambooattemptxmldatabuilddirinttstsrcmainjavacomatlassianthepluginideacrucibleeditoropendifftoolactionjava jan optjeedomainsbambooatlassiancomgdanskwebappsdatabambooattemptxmldatabuilddirinttstsrcmainjavacomatlassianthepluginideacrucibleeditorcrucibleeditorfactorylistenerjava jan error occurred executing build inttst unable retrieve source code inttst jan change detection found changes jan build inttst started building agent default agent noformat noformat jan build inttst started building agent default agent jan updating source code latest jan working directory optjeedomainsbambooatlassiancomgdanskwebappsdatabambooattemptxmldatabuilddirinttst empty checking svn url jan optjeedomainsbambooatlassiancomgdanskwebappsdatabambooattemptxmldatabuilddirinttstlicense jan optjeedomainsbambooatlassiancomgdanskwebappsdatabambooattemptxmldatabuilddirinttstatlassianideapluginipr jan optjeedomainsbambooatlassiancomgdanskwebappsdatabambooattemptxmldatabuilddirinttstdoc jan error occurred executing build inttst failed checkout source code revision head jan manual build triggered wseliga jan build inttst started building agent default agent jan updating source code latest jan source found optjeedomainsbambooatlassiancomgdanskwebappsdatabambooattemptxmldatabuilddirinttst updating source jan optjeedomainsbambooatlassiancomgdanskwebappsdatabambooattemptxmldatabuilddirinttstdoc jan optjeedomainsbambooatlassiancomgdanskwebappsdatabambooattemptxmldatabuilddirinttstsrc jan optjeedomainsbambooatlassiancomgdanskwebappsdatabambooattemptxmldatabuilddirinttstsrctest jan optjeedomainsbambooatlassiancomgdanskwebappsdatabambooattemptxmldatabuilddirinttstsrctestjava jan optjeedomainsbambooatlassiancomgdanskwebappsdatabambooattemptxmldatabuilddirinttstsrctestjavadocs jan optjeedomainsbambooatlassiancomgdanskwebappsdatabambooattemptxmldatabuilddirinttstsrctestjavacom jan optjeedomainsbambooatlassiancomgdanskwebappsdatabambooattemptxmldatabuilddirinttstsrctestjavacomatlassian jan optjeedomainsbambooatlassiancomgdanskwebappsdatabambooattemptxmldatabuilddirinttstsrctestjavacomatlassiantheplugin jan optjeedomainsbambooatlassiancomgdanskwebappsdatabambooattemptxmldatabuilddirinttstsrctestjavacomatlassianthepluginbamboo jan optjeedomainsbambooatlassiancomgdanskwebappsdatabambooattemptxmldatabuilddirinttstsrctestjavacomatlassianthepluginbambooapi jan optjeedomainsbambooatlassiancomgdanskwebappsdatabambooattemptxmldatabuilddirinttstsrctestjavacomatlassianthepluginidea jan optjeedomainsbambooatlassiancomgdanskwebappsdatabambooattemptxmldatabuilddirinttstsrctestjavacomatlassianthepluginideagenericserverconfigurationformtestjava jan optjeedomainsbambooatlassiancomgdanskwebappsdatabambooattemptxmldatabuilddirinttstsrctestjavacomatlassianthepluginideabamboo jan error occurred executing build inttst unable retrieve source code null inttst noformat noformat optjeedomainsbambooatlassiancomgdanskwebappsdatabambooattemptxmldatabuilddirintcssrcmainjavacomatlassianthepluginideacruciblecruciblerevisionsnumberjava jan optjeedomainsbambooatlassiancomgdanskwebappsdatabambooattemptxmldatabuilddirintcssrcmainjavacomatlassianthepluginideacrucibletreereviewitemtreepaneljava jan optjeedomainsbambooatlassiancomgdanskwebappsdatabambooattemptxmldatabuilddirintcssrcmainjavacomatlassianthepluginideacrucibletree jan optjeedomainsbambooatlassiancomgdanskwebappsdatabambooattemptxmldatabuilddirintcssrcmainjavacomatlassianthepluginideacruciblecruciblecreatepostcommitreviewformjava jan optjeedomainsbambooatlassiancomgdanskwebappsdatabambooattemptxmldatabuilddirintcssrcmainjavacomatlassianthepluginideacrucibleeditoreditordiffactionimpljava jan optjeedomainsbambooatlassiancomgdanskwebappsdatabambooattemptxmldatabuilddirintcssrcmainjavacomatlassianthepluginideacrucibleeditoreditorupdatediffactionimpljava jan error occurred executing build intcs unable retrieve source code intcs jan purging checked code optjeedomainsbambooatlassiancomgdanskwebappsdatabambooattemptxmldatabuilddirintcs jan manual build triggered wseliga jan build intcs started building agent default agent jan updating source code revision noformat however executing svn command line exactly host bamboo installed credentials even worked fine two problems bamboo bump build number build failed nowhere really shown dashboard via remote api still got last build successful although build number logs greater bamboo claimed dashboard via api last build happened last one problems started cleaning working dir full checkout help solved problem full clean using anonymous svn access private account bamboo finally showed new build dashboard number real status suspect problem may also somehow connected svn server could applied security policies avoid dos attacks bamboo bamboo every minutes hundred times trying checkout svn sources without success,2
BAM-3612,talkback elastic agent bamboo server include ebs volume mount results,elastic instanceagent configured mount ebs volume containing snapshot startup progresssuccessfail fed back bamboo server display log tmpsetupebssnapshotlog could used process progress results,2
BAM-3616,users see maven module groupid artifactid version plan,respect subworking directory look poms subworking directory read top level pom modules pom read building read plan may multiple artifacts,5
BAM-3620,postbuildprocessor plugin kick maven pomxml parsing,consider running remote agents functional test postbuilderprocessor plugin behavior,2
BAM-3626,allow gadget server plugin incorporated bamboo,include oauth sal read details,5
BAM-3631,implement sal part,goal goal get compatible sal compatibility kit however tackling subset sal implementation figure much compatibility kit targeting note changed storypoints given tackling sal,5
BAM-3633,implement sal part,remaining work sal see bam part,8
BAM-3634,alert users builds built agents,bamboo alert user plan built period time set default overridden removed user necessary avoid following,1
BAM-3679,patch activemq fix code problem fix hanging agent problem,relies bam minimal patch could ship customers imply creating activemq branch atlassian maintain etc etc,3
BAM-3681,reproduce bam extreme cpu spike beac,little idea could much success reproing,12
BAM-3693,add ability sleep collecting artifacts bamboo agent,build ends bamboo sweeps artifacts like system property agent could introducce small sleep would allow build settle save artifacts agent comes along collect,2
BAM-3695,bamboo specfic functional tests sal intefaces,ctk testing plugin generic testing interfaces return something need write bamboo specific tests ensure bamboo actually right thing underneath sal calls,3
BAM-3718,implement sal interfaces part,implement interfaces didnt make last milestone see page details items missed,5
BAM-3724,spike deploy gadget server bamboo hello world gadget prove,estimates include infrastructure assuming plugins done depends implement sal authentication mechanism yet see consumed sure ref app consume timebox spike person iteration,12
BAM-3728,bam regression incorrect display faiing since test,investigation required keep sam berlin happy done stable branch,5
BAM-3731,bam regression test names throws error,need escape properly done stable branch,2
BAM-3733,implement bundled plugins part,delivery mechanism gadget server try plugin known work sal,1
BAM-3735,rest module type plugin point,drop plugin,2
BAM-3737,rest endpoint build status gadget,requires mockups done,3
BAM-3740,gadget user authenticate gadget,means manual usernamepassword must inputted use basic auth oauth obselete oauth,3
BAM-3742,gadget user see status favourite plans,interactions links back server edwin get teams give mock ups,5
BAM-3745,gadget user see status recent builds favourite plans existing status gadget,display rest provide info need mockup story assume mockup already,3
BAM-3748,gadget user select plans want watch,selection based read permissions authenticated user pick individual plans favourite plans whilst selecting favourited still indicated top storage configuraiton gadge consumer,5
BAM-3766,upgrade default ami newer version fedora linux see reduced scope issue,current default ami amicdda case many updates pending isnt wise instance startup see noformat rootdomub bambooebs yum update loading fastestmirror plugin loading mirror speeds cached hostfile fedora archivefedoraprojectorg updates archivefedoraprojectorg setting update process resolving dependencies running transaction check package fedorareleasenoarch transition set updated finished dependency resolution dependencies resolved package arch version repository size updating fedorarelease noarch transition updates transaction summary install packages update packages remove packages total download size downloading packages fedorarelease running rpmcheckdebug running transaction test finished transaction test transaction test succeeded running transaction updating fedorarelease cleanup fedorarelease updated fedorareleasenoarch transition complete rootdomub bambooebs yum update loading fastestmirror plugin loading mirror speeds cached hostfile updatesnewkey archivefedoraprojectorg fedora archivefedoraprojectorg updates archivefedoraprojectorg updatesnewkey primarysqlitebz setting update process resolving dependencies running transaction check package ntpi pfc set updated package vimenhancedi set updated package openldapi set updated package fusedeveli set updated package bindutilsi pfc set updated package pythonlibsi set updated package pcrei set updated package yumnoarch set updated processing dependency pygpgme package yum package rubyi set updated package logwatchnoarch set updated package kernelxeni set installed package utillinuxngi set updated package vimminimali set updated package vixiecroni set updated package alsalibi set updated package iptablesi set updated package libxmli set updated package libpngi set updated package nssi set updated package papslibsi set updated package libacli set updated package openobexi set updated package libnfnetlinki set updated package acli set updated package microcodectli set updated package hallibsi set updated package pygobjecti set updated package rsynci set updated package rubyirbi set updated package bluezlibsi set updated package bindlibsi pfc set updated package systemconfignetworktuinoarch set updated package beecrypti set updated package gtki set updated package fuselibsi set updated package libediti cvsfc set updated package edi set updated package networkmanagerglibi svnfc set updated processing dependency networkmanager svnfc package networkmanagerglib package dbi set updated package dhcpvclienti set updated package freetypei set updated package pythonurlgrabbernoarch set updated package coreutilsi set updated package efsprogsi set updated package psmisci set updated package libsysfsi set updated package auditlibsi set updated package libgladei set updated package quotai set updated package cupslibsi set updated package perllibsi set updated package fedoragnomethemenoarch set updated package libdhcpclienti set updated package iptablesipvi set updated package libtiffi set updated package autofsi set updated package ypbindi set updated package anacroni set updated package controlcenterfilesystemi set updated package nfsutilsi set updated package smartmontoolsi set updated package wgeti set updated package pmutilsi set updated package sudoi pfc set updated package popti set updated package shadowutilsi set updated package dbusglibi set updated package traceroutei set updated package kernelheadersi set updated package rubyrdoci set updated package infoi set updated package pamkrbi set updated package bluezutilsi set updated package curli set updated processing dependency libsshso package curl package gnupgi set updated package hali set updated package filelibsi set updated package bziplibsi set updated package rubygemsnoarch set updated package perli set updated package policykiti set updated package aspelli set updated package efsprogslibsi set updated package rubylibsi set updated package sharedmimeinfoi set updated package yumfastestmirrornoarch set updated package ntfsgi set updated package iproutei set updated package stunneli set updated package fusei set updated package elfutilslibelfi set updated package libxcbi set updated package wpasupplicanti set updated package libxslti set updated package libgnomecanvasi set updated package tzdatanoarch ifc set updated package fusesshfsi set updated package gnutlsi set updated package pciutilsi set updated package glibi set updated package nsstoolsi set updated package mlocatei set updated package bzipi set updated package fuseencfsi set updated processing dependency libboostserializationmtso package fuseencfs processing dependency libboostfilesystemmtso package fuseencfs package halinfonoarch set updated package cupsi set updated package ejecti set updated package makei set updated package nspri set updated package vimcommoni set updated package filei set updated package papsi set updated package pythoni set updated running transaction check package libsshi set updated package networkmanageri svnfc set updated processing dependency ppp package networkmanager processing dependency dnsmasq package networkmanager processing dependency avahiautoipd package networkmanager package pygpgmei set updated processing dependency libgpgmesogpgme package pygpgme processing dependency libgpgmeso package pygpgme package boosti set updated processing dependency libicuucso package boost processing dependency libicuinso package boost running transaction check package gpgmei set updated processing dependency gnupg package gpgme processing dependency libpthso package gpgme package avahiautoipdi set updated package libicui set updated package pppi set updated package dnsmasqi set updated running transaction check package gnupgi set updated processing dependency libksbasoksba package gnupg processing dependency dirmngr package gnupg processing dependency libksbaso package gnupg processing dependency pinentry package gnupg package pthi set updated running transaction check package dirmngri set updated package libksbai set updated package pinentryi set updated finished dependency resolution dependencies resolved package arch version repository size installing networkmanagerglib svnfc updatesnewkey replacing networkmanageri svnfc kernelxen updatesnewkey updating policykit updatesnewkey acl updatesnewkey alsalib updatesnewkey anacron updatesnewkey aspell updatesnewkey auditlibs updatesnewkey autofs updatesnewkey beecrypt updatesnewkey bindlibs pfc updatesnewkey bindutils pfc updatesnewkey bluezlibs updatesnewkey bluezutils updatesnewkey bzip updatesnewkey bziplibs updatesnewkey controlcenterfilesystem updatesnewkey coreutils updatesnewkey cups updatesnewkey cupslibs updatesnewkey curl updatesnewkey updatesnewkey dbusglib updatesnewkey dhcpvclient updatesnewkey efsprogs updatesnewkey efsprogslibs updatesnewkey updatesnewkey eject updatesnewkey elfutilslibelf updatesnewkey fedoragnometheme noarch updatesnewkey file updatesnewkey filelibs updatesnewkey freetype updatesnewkey fuse updatesnewkey fusedevel updatesnewkey fuseencfs updatesnewkey fuselibs updatesnewkey fusesshfs updatesnewkey glib updatesnewkey gnupg updatesnewkey gnutls updatesnewkey gtk updatesnewkey hal updatesnewkey halinfo noarch updatesnewkey hallibs updatesnewkey info updatesnewkey iproute updatesnewkey iptables updatesnewkey iptablesipv updatesnewkey kernelheaders updatesnewkey libacl updatesnewkey libdhcpclient updatesnewkey libedit cvsfc updatesnewkey libglade updatesnewkey libgnomecanvas updatesnewkey libnfnetlink updatesnewkey libpng updatesnewkey libsysfs updatesnewkey libtiff updatesnewkey libxcb updatesnewkey libxml updatesnewkey libxslt updatesnewkey logwatch noarch updatesnewkey make updatesnewkey microcodectl updatesnewkey mlocate updatesnewkey nfsutils updatesnewkey nspr updatesnewkey nss updatesnewkey nsstools updatesnewkey ntfsg updatesnewkey ntp pfc updatesnewkey openldap updatesnewkey openobex updatesnewkey pamkrb updatesnewkey paps updatesnewkey papslibs updatesnewkey pciutils updatesnewkey pcre updatesnewkey perl updatesnewkey perllibs updatesnewkey pmutils updatesnewkey popt updatesnewkey psmisc updatesnewkey pygobject updatesnewkey python updatesnewkey pythonlibs updatesnewkey pythonurlgrabber noarch updatesnewkey quota updatesnewkey rsync updatesnewkey ruby updatesnewkey rubyirb updatesnewkey rubylibs updatesnewkey rubyrdoc updatesnewkey rubygems noarch updatesnewkey shadowutils updatesnewkey sharedmimeinfo updatesnewkey smartmontools updatesnewkey stunnel updatesnewkey sudo pfc updatesnewkey systemconfignetworktui noarch updatesnewkey traceroute updatesnewkey tzdata noarch ifc updatesnewkey utillinuxng updatesnewkey vimcommon updatesnewkey vimenhanced updatesnewkey vimminimal updatesnewkey vixiecron,1
BAM-3801,gadget user view chart recent percentage builds successful,select plans grouped time period configurable filter time period last days last days last days last builds show builds,3
BAM-3804,prevent build running ancestors queue running,depends triggered whilst building trigger ignored mean checkins wont run optional must block parent revision child build otherwise child might never build,3
BAM-3805,user configure dependency blocking,applicable per child plan user configure whether dependency children blocked building ancestors running,2
BAM-3806,check ancestors build triggered prevent building changes found ancestors ancestors kicked,triggered whilst building check changes found build dont build manual dependent builds schedule build ignore trigger later optimizations needed,12
BAM-3807,detect infinte cycles dependent builds,allow users input cyclic dependency configurations customers already done cyclic dependencies dont anything upgrade task show error try show tree,2
BAM-3808,user see text ancestors children build result,see parents see children,5
BAM-3809,get gadget authenticate end end via oauth,takes away need manually input usernamepassword,5
BAM-3890,notfication build queue minutes,similar build hung notification builds queue,3
BAM-3905,test failing since doesnt properly consider builds without test results,case consider series builds build test passed build test failed build build failure test results build test failed build test failed results build build bamboo reports test failing since build developers incorrectly infer test passed build change caused failure introduced build case would better report test failing since build case theres another interesting case needs considered build test passed build build failure test results build build failure test results build test failed failure test could introduced build build build case perhaps best report test failing since build,3
BAM-4030,make possible via instructions customer bamboo enable ami,per krystians comments want make possible customer follow instructionsinstall software instances ami spawned bamboo server elastic agents start get endless cycle upgrading default ami,5
BAM-4037,add support availability zones,see talking availability zone support prerequisite reserved instance support default availability zone bamboo install able specify avail zone per elastic configuration,5
BAM-4088,rename elasticagentschedule elasticinstanceschedule,also rework associated text,1
BAM-4341,roundtrip error input validation instance startup,round trip errors occur ecinstance screen invalid number instances requested,1
BAM-4360,ensure commands mounting ebs volumes handle failure recursively,ebs volume creation attachment mounting still depending various variable timing amazon especially multiple volumes stared simultaneously ensure cater failure perform retries commands,2
BAM-4367,please make maven builder available image,confluence need maven specifically build confluence,2
BAM-4378,set last modified header artifacts browsers cache static resources,since build artifacts static probably never change created bamboo set last modified header serving artifact timestamp file stored disk could used unavailable time stamp build finished large artifacts json needed clovers new tree map could greatly benefit browsers needful caching,1
BAM-4386,instance schedule seems shut instances,schedule configured seems kill available instances since seems looks instance list even already scheduled shut agent stopped instance still list instead checking given instance shut agent present,1
BAM-4416,failed ebs volume creaion start disabled,startup ebs volume fails instance agent start disabled,2
BAM-4424,allow clover license entered via bamboo admin global license license overridden plan config level,build config screen global license exists display message indicating license already configured build config screen global license exists license valid display message indicating license valid build config screen global license exists license invalid display message indicating license valid build config screen global license exists text entry field available message indicating license required displayed text entry field available build config screen allow license overridden plan level license defined plan level takes precedence check interaction cloverlicense settingsxml validation lic optional nice iff extras supports decoding,3
BAM-4497,update dependencies match jiras,jira finalised dependencies ensure gadgets actually work probably need ensure oauth atlasianplugins atlassiangadgets libraries updated version jira double check gadgets work,2
BAM-4503,ship version nant builder plugin bamboo,changes plugin api bamboo broken nant builder plugin new version plugin available,1
BAM-4535,quick dirty way add plan stage chain,suggestion chain stage selector plan edit page need hide anything plan edit page,3
BAM-4574,package gadgets,gadgets use directly,1
BAM-4704,installer setting bamboo home,installing bamboo using windows installer bamboo start bamboohome set checked bambooinitproperties updated see installj logs,1
BAM-4731,miscellaneous ugliness,remembering tab youre configuraiton tooltips broken styling tabs build configuration dropdown build menu narrow build configuration tabs longer check data saved navigating away tab,3
BAM-4780,spike backend support remote agents,acceptance criteria remote agents concurrently connect one server remote agents include remote elastic agents builds concurrently run,20
BAM-4806,upgrade aui,aui changes currently compatible bamboos especially restrictions imposed selector longer allowed needed upgrade pack,2
BAM-4857,show rest gadgets urls within,rest url appear enable remote api part description add new section page list gadget urls oauth minimal req urls descriptions stuff would cool,3
BAM-4869,add function remove oauth tokens bamboo,please add function remove oauth tokens bamboo already implemented jira thats helpful reference,5
BAM-4871,rest incorrect representation json data,json data returned builds rest api service incorrect please see screenshots example,3
BAM-4905,plan requirements updated builder jdk updated,update plans builder spec reflected plans requirements example changing jdk builder spec requirements tab still show jdk,2
BAM-4922,removing build results menu confirmation screen,deleting list page currently uses popup prefer popup fine add confirmation screen consistent work classconfirmationrequired fix wording conssitent,1
BAM-4924,editing plans done button artifacts doesnt work,view version artifacts screen,2
