issuekey,title,description,storypoint
DURACLOUD-193,navigating away upload progress causes upload fail,quick fix provide warning user better solution probably make spacesservicesadminand dashboard pages driven page making various sections spacesservicesetc addressable hashmark,1
DURACLOUD-195,uploads dialog gets little messy files uploaded close button sits stuff cant see bottom scroll bar etc,uploads dialog gets little messy files uploaded close button sits stuff cant see bottom scroll bar etc,1
DURACLOUD-196,mark image files space closed indicating viewer available open spaces,would really useful notice box image files space closed indicating viewer available open spaces viewing service deployed,1
DURACLOUD-197,make available services explicit,services tab click deploy new service view list available services currently running would nice information somehow presented immediate service page wasnt immediately apparent services could run,1
DURACLOUD-198,duradmin add content item button available prior selecting space,add content item button spaces tab duradmin selected without choosing space add content dialog box opens allows interact usual click add button nothing happens add content item button likely grayed space selected,1
DURACLOUD-200,new storageprovider msazure,feature create storageprovider implementation ala emcstorageproviderjava rackspacestorageproviderjava sstorageproviderjava microsofts azure storage offering,13
DURACLOUD-202,server health status monitoring,toplevel feature span dashboard backend status exactly functionality expected feature needs investigation examples may include usage storage requests bandwidth consumption uploads downloads etc storage breakdowns space mimetype storage provider etc cost estimating see following page ideas,13
DURACLOUD-204,persisting user passwords,improvement persist system user credentials enable ones used across migrations new duracloud instance,1
DURACLOUD-207,service configuration exclusion groups,task update serviceconfig schemas support notion exclusion groups deployment configuration services allows dynamically display appropriate input elements based initial selections made user see duracloud,2
DURACLOUD-215,service exclusion groups modifications,changes support duracloud,1
DURACLOUD-217,chrome misbehavior,wed aug bryan beecher bryanumichedu wrote really weird chrome throws tomcat error hangs firefox works aok ill use firefox bryan wed aug bryan beecher bryanumichedu wrote hey carissa logged changed password hitting submit got page useraccountnonexpiredtrueaccountnonlockedtruecredentialsnonexpiredtrueenabledtruegrantedauthoritiesroleadminroleuserpasswordomittedusernameadmin contains new password however whenever navigate home page url get response tomcat long stack trace send helpful cutnpaste url different browser get login screen hangs try authenticate bryan,1
DURACLOUD-220,service report dashboard,task create dashboard displaying downloading reports service jobs information running services completed services need displayed rest api calls available service report information gathered need created able display information reports reports likely xml xslt option display,5
DURACLOUD-222,service configuration schema update nested modes,improvement update servicetypesxsd define servicetype current sequence config elements well modetype contains another modetype sequence config elements,1
DURACLOUD-223,service report backend utility completed services,feature provides backend support providing service summary details services completed completed defined either coming state success failure case services stay running imageserver coming state started service summaries collected soon service completes persisted single file containing services single report file start fresh monthly basis,5
DURACLOUD-224,duradmin enter key properly submit content detail edit,editing mimetype content item duradmin using edit content item dialog using enter key submit save value input returns user main spaces view space selected using save button works fine using enter key perform function clicking save,1
DURACLOUD-225,duradmin next previous buttons content list displayed even necessary,recently added next previous buttons allow cycling large sets content items seem show even content items space buttons available content items displayed scroll window,1
DURACLOUD-226,duradmin login button login screen respond enter key chrome,using google chrome browser attempting log via duradmin login button triggered hitting enter key clicking login button works fine firefox clicking button hitting enter key work fine,1
DURACLOUD-228,cannot display spaces duraadmin,logging duraadmin web app navigate tabs successfully selecting spaces tab get popup says errorundefined sync tool also exhibits problem trying access spaces starting sync tool exception thread main javalangruntimeexception could connect space synctest orgduracloudsyncendpointdurastoresyncendpointensurespaceexistsdurastoresyncendpointjava orgduracloudsyncendpointdurastoresyncendpointinitdurastoresyncendpointjava orgduracloudsyncendpointdurastorechunksyncendpointinitdurastorechunksyncendpointjava orgduracloudsyncsynctoolstartsyncmanagersynctooljava orgduracloudsyncsynctoolrunsynctoolsynctooljava orgduracloudsyncsynctoolmainsynctooljava,1
DURACLOUD-229,content complete list size,number content items within space exceeds maxresults parameter set greater default contentiteratorjava eventually terminates early underlying query storage provider maxresults account possibility space metadata content object may listing since client return max items regardless maxresults parameter call effectively turns call items logic contentiterator terminating number items listing returned less maxresults parameter case items returned one removed space metadata object,1
DURACLOUD-230,exception thrown duradmin initialization,attached stacktrace begun appearing catalinaout log running appconfig initialization tool downloading various revisions baseline able associate origins stacktrace svn aug observe stacktrace running mvn clean install dskiptests top baseline followed java jar appconfigtargetappconfigsnapshotdriverjar localhostproperties unclear mods trunkduradminsrcmainwebappwebinfconfigtilesxml trunkduradminsrcmainwebappwebinfjsperrorjsp cause error allow visible catalinaout log note also get result running following curl command curl duradmininitxml unpw,1
DURACLOUD-231,allow users select storage class,release content added set reduced redundancy storage class tasks available transition content given space particular storage class either standard reduced redundancy task provide way user select storage class would prefer set new content added selection would content account later tasks need handle provide selection storage class space level provide way users transition existing content preferred storage class likely service leverages existing tasks,3
DURACLOUD-232,restapi create toplevel exception barrier,improvement create toplevel exception barrier durastore duraservice restapis currently unexpected exceptions appear client response either stacktrace tomcat html error document,1
DURACLOUD-233,add support cloudfront invalidation,since media streaming service created amazon added feature called invalidation provides api call remove content cloudfront media streaming service updated make use call stopping service content longer available streaming service turned,1
DURACLOUD-235,metadata name prefix mismatch durastore duradmin,duradmin metadata prefix extension durastore metadata prefix durastore xdurameta duradmin xdurametaext therefore metadata created durastore restapi may contain full prefix duradmin expecting two prefixes need made consistent logic probably pushed duradmin storeclient,3
DURACLOUD-237,test infrastructure mocking integration tests,improvement allow developers run test suites often reducing amount time takes run build many integration tests unnecessarily way underlying storageproviders tests revisited eye towards mocking network calls overly redundant,8
DURACLOUD-239,duradmin uploaded file displayed wrong space,uploading file upload completes content uploaded file added list items currently viewed space even space item stored clicking content brings get item failed error dialog clicking either space one viewed one upload landed allows refresh show correct listing,1
DURACLOUD-240,duradmin images closed spaces displayed service exists,duracloud space closed view link still attempts open viewer along current notice link open space images act like service deployed space opened,1
DURACLOUD-249,fedora integration basicauth externally referenced datastreams,feature duracloud marker fedora issue,1
DURACLOUD-255,incorrect redirects http,saw testing poster performing put add new content item everything right except use http rather url end response using see happens sent back original request forwarded address get rather put result attempting get content item exist would appear http verb lost redirect,2
DURACLOUD-256,machines able login duradmin,brian beecher andrew seen occasional problems logging symptom user tries logging correct credentials failure success brian using chrome doesnt see problem cognito mode seems caching issue,1
DURACLOUD-257,use amazon java client cloudfront,duracloud transitioned majority interactions using amazonprovided java client unfortunately work done client yet support cloudfront access cloudfront continued jetst amazon library updated include cloudfront task complete transition remove jetst sstorageprovider dependencies,1
DURACLOUD-259,create ami,production ami contain removal bundlehomecontainer work attic shutdown etcinitdduraspace script update etcapache include following line rewritelock varlockapacheapacherewritelock new rewritemap localipmap prgetcapachebinlocalipsh already present touch varlockapacheapacherewritelock,2
DURACLOUD-260,login failure browsersenvironments,firefox chrome opera occasionally firefox chrome first time usernamepassword provided enter key hit fields clear immediately reinserting values always succeeded,1
DURACLOUD-261,allow storeclient handle redirects,currently storeclient initialized use port connect durastore fail making calls responses redirect port task allow storeclient retry using redirect path rather failing update would likely benefit serviceclient well,2
DURACLOUD-265,ensure integrity input content hadoop services,improvement revisit hadoop services fixity bulk image conversion replication demand ensure content pulled valid respect stored value,3
DURACLOUD-266,notification service completion,task provide notification user running service service completes notification include link final output report one generated service original description bryan beecher suggested adding sort popup email message indicator might good idea fixity service finished job running isnt clear tell finished beyond polling services page,5
DURACLOUD-270,pagination delete,scenario revealed wanting clear entire contents space first hundred items space many items commonly case log output hadoop jobs select space select checkbox marks items shown current page select delete selected content items notice items deleted select next button notice next page items displayed refresh space hitting space name notice next page items displays,1
DURACLOUD-271,message creating space already exists,creating space already exists following popup displays error error space undefined normally determine error must relate fact space already exists sometimes creating new space action fails space listed lefthand side listing spaces despite failure space actually created although shown trying create shows error space undefined message make easy determine actual error suggestion render specific error message,1
DURACLOUD-272,metadata add button label removed focus,adding metadata either space content add metadata button label removed soon button gets focus follows name value text removed metadata text fields happen button,1
DURACLOUD-274,handle filenames include spaces,issue review current set duracloud services utilities including sync retrieval tools determine ones currently support working content items include space character content ids list identified service utility updated handle case,3
DURACLOUD-275,duraadmin view images closed space viewer,remove notice space needs open order view image viewer change link view closed images viewer also change viewer url param http make sure release issue duracloud,1
DURACLOUD-276,update sync tool command line flags match retrieval tool flags,following flags need updated sync tool match retrieval tool password change port change backup work directory change sync content directory change sync deletes change exit completion change add store,1
DURACLOUD-277,update retrieval tool skip space dir creation single space retrieval,necessary retrieval tool create directory space retrieved retrieval single space task update retrieval tool one space retrieved files directly content directory multiple spaces retrieved space directories created case currently,1
DURACLOUD-278,selecting single space deletion displays delete multiple spaces warning,duradmin select single space deletion far right youll see multiple spaces selected message clicking delete selected spaces youll also get warning says sure want delete multiple spaces obviously little confusing causes double check arent accidentally delete multiple spaces,1
DURACLOUD-279,bulk image transformation failures,bulk image transformation service failed numerous tests set tiff images files supplied rhodes set includes images ranging size primary test case converting format using source color space service failed running instance instance size service also failed test running xlarge instance mappers watching memory consumption small instance service running shows significant amount memory consumed mogrify step run using bash script call imagemagick swap space consumed less memory remained available testing indicated size images transformed likely plays role failures moving two largest rhodes files another space rest tiffs allowed transformation complete successfully using xlarge instances running conversion set instance regardless size still failed however attached file shows list tiff files successfully transformed tests well files tests failed large instance run two mappers xlarge instance mappers,5
DURACLOUD-281,duraservice resolve spaces providers,improvement servicemanagerjava resolve spaces providers service config object specifies allstorespaces mode,1
DURACLOUD-282,bit integrity service update service config provider spaces,improvement change bit integrity service leverage mode schema element specify need resolving spaces providers,3
DURACLOUD-283,duplicate upload ensure metadata included,improvement ensure content replicated via duplicate ingest service also duplicate usersupplied metadata,1
DURACLOUD-285,bottleneck hadoop processing,two runs bulk bit integrity service set bhl content took approximately amount time minutes hours problem first run used small instances second run used xlarge instances xlarge instance completed task much faster higher bandwidth compute capacities also set use mappers per instance rather small instance setting task discover fix bottleneck allowing xlarge instances run full capacity,3
DURACLOUD-286,allow system services deployed along services depend,task remove system services imagemagick webapp util list deployable services instead deployed needed dependent services deployed likely mean bundling jars services services dependency updating start deployed osgi,2
DURACLOUD-287,odd characters seemingly replace copyright symbol utf issue,bottom duradmin says duraspaceorg,1
DURACLOUD-288,msazure space item count one,number items listed empty azure space number items listed azure space one content item etc,1
DURACLOUD-289,retrieval tool retrieve list specific files,think retrieval tool missing option retrieve specific files specific space dspace use case partial restore may wish retrieve portion files space rather pull would like able request specific files name comma separated list names regular expression could also work list exact names would seemingly meet needs dspace dspace aip files stored duracloud specific names similar collectionzip itemzip generally aip name specific format dspaceobjecttypedspaceobjectidentifierzip dspace install wanted restore particular object small set objects might nice request objects name rather pull entire space know specific case thats currently missing either need simple solution retrieval tool need dspacespecific tool support partial content restores user wants restore particular set items single collection,2
DURACLOUD-293,improve performance retrieve content metadata azurestorageprovider,move generation content checksum getcontentmetadata addcontent also waiting feedback azure team find provide etag,1
DURACLOUD-294,create release,ami amifd docs artifacts created pushed dcprod atlas per,1
DURACLOUD-295,using previous next buttons duracloud administrator interface space detail section right disappears,navigating list content items space using previous next buttons duracloud administrator interface space detail section right disappears reappears reselect space click individual item,1
DURACLOUD-298,bit integrity service split two services,clean bit integrity service include remove salt split service two services bit integrity tools generate compare bit integrity verify,1
DURACLOUD-299,crossservice clean,clean include change order services logical possibly alphabetical change name services prefix variations service example bit integrity service bulk,1
DURACLOUD-301,provide clear visual cue duradmin indicate storage provider currently selected,observed using duradmin easy forget storage provider selected perform action wrong provider task provide visual cue help distinguish providers one potential way would storage provider correspond different color color displayed prominently perhaps even spaces area background provider selected,4
DURACLOUD-302,remove location selection service deployment via duradmin,able select alternate deployment location deploying service feature come road meantime display option none services use,1
DURACLOUD-303,simplify deployment bulk services,items simplify bulk services duplicate demand bulk image conversion bulk bit integrity checker use default setting number type instances number type depend service require testing determine reasonable default large instances work bulk bit integrity testing pilot partners help narrow good defaults duplicate demand bulk image conversion,3
DURACLOUD-304,update image transformer service deployment options,changes apply image transformer bulk image transformer services clarify destination color space confused duracloud space move file name prefixsuffix options directly source space,1
DURACLOUD-305,azure storage provider list space contents contains truncated contentid,name attribute returned iblobcontainerlistblobs sometimes truncates contentid instead parse contentid uri attribute azurej fixes issue,3
DURACLOUD-306,bit integrity service simplify user options,improvement update bit integrity service following ways create default space output create autogenerated output name provide checkbox providing input listing name add checkbox input listing cause input listing generated metadata,3
DURACLOUD-307,bulk bit integrity service simplify user options,improvement include following updates bulk bit integrity service remove config option uixml destination space service output automatically right space xserviceout content prefix bitintegritybulk remove config option uixml working space service automatically set working space xservicework,2
DURACLOUD-309,audit log service,task capture make available users audit logs list activities occurred duracloud likely need separate set logs storage services messaging support completed storage services new service could created listen messages sent store write log files stored users storage area,3
DURACLOUD-310,audit logging storage,task capture audit information relating storage events users single location listener running times users storing results within duracloud storage,5
DURACLOUD-311,sync tool syncing dsstore files mac,sync tool syncs dsstore files peripheral files autogenerated mac folder actually content needs synced duracloud would nice tool knew automatically ignore types files,2
DURACLOUD-312,serviceinfoclone,clone method needs implemented order deployedservices within servicemanagerjava systemconfig data member become null deployment currently going scope,1
DURACLOUD-313,security initialization,improvement disallow updates root user security credentials via rest api,2
DURACLOUD-314,bulk bit integrity service error allocating memory,issue resolve bug recorded following link bryan beecher icpsr hadoop logs attached brief scan logs indicates hadoop servers running memory,3
DURACLOUD-315,storage usage report service,provide way generate report least following information number files space total size files stored space average file size space file types mimetypes represented space total number files spaces total size files spaces average size file spaces file types mimetypes represented spaces information storage provider use reports available download stored within duracloud referenced periodically point may want provide way schedule running reports monthly would seem good fit service gathers needed information formats stores output space restapi exposed client access reports feature suggested markus wust ncsu pilot partner meeting dec also interested seeing information included reports relates storage costs,13
DURACLOUD-318,bit integrity service incorrect report item list exist,david arjanik columbia unable successfully complete use case preservation monitoring test heres excerpt notes regarding use case test plan service test using initial listing test create new listing file mds altered entire line items removed new line items arjanik done altered checksums first three lines deleted next three lines added two lines end files duracloud instance uploaded admin usecaseservicetestmd run fixity service altered listing input previous test arjanik reconfigured service run new file report ran successfully generating files fingerprintsservicetestcsv integrityreportservicetestcsv names specified reconfiguration iii verify erroneous entries identified generated report arjanik downloaded fingerprintsservicetestcsv integrityreportservicetestcsv arjanik checked integrityreportservicetestcsv file attached one line report data spaceid contentid adminusecaseservicetestmd adminfingerprintsservicetestcsv status invalid manifest file newspace readmetxt error metadata null newspacereadmetxt arjanik deleted new file generated report files service test admin space try reconfigured redeployed service downloaded results results edited file replaced fictitious space newspace usecase deleted old report files redeployed service downloaded reports renamed integrity report integrityreportservicetestndtrycsv attached results basically opened fingerprints file new lines correctly identified referring files didnt exist duracloud six files ive attached perfect match test usecasemd input file listing correct space contents correct checksums fingerprintscsv checksum file generated bit integrity checker integrityreportcsv diff report generated bit integrity checker test successful errors test checksums first three files list changed next three files removed list last two lines refer files duracloud instance fingerprintscsv file appears use incorrect formatting last two lines lines files dont exist instance integrityreportcsv malformed integrity report service configuration service mode verify integrity list items get integrity information fromthe storage provider salt empty store amazons space input listing admin input listing name usecaseservicetestmd output space admin output listing name fingerprintscsv output report name integrityreportcsv,1
DURACLOUD-319,duplicate demand service failing,duplicate demand service failed service configuration source space synctest copy store rackspace copy space replicants store results file space replicateout working space tmp number server instances type server instance large instance service final status job ended utc service status job complete serviceid replicationondemandservice servicestatus started job state failed job started utc job jpdvcsadtpq additional statistics run icpsrduracloudorg synctest source space items closed space tmp work space log files generated one run service job jpdvcsadtpq ran minutes failing mapreduce job failed minutes files successfully duplicated logs stepsstderr shows task attempts killed responding minutes,2
DURACLOUD-320,duradmin upload failures multiple large files,uploading multiple files duradmin failures frequently occur causing content land durastore scenario select file upload five times row duradmin using different contentids waiting one complete uploading verify five files successfully upload scenario consistently fails,1
DURACLOUD-323,bulk bit integrity service add comparison,bulk bit integrity service contain following updates add optional config option takes userspecified input listing used verify mds hadoop servers generated new listing listing provided service compare mds stored storageprovider metadata post processing implemented postjobworker,3
DURACLOUD-324,reverse upload history order upload window,would nice reverse order upload history upload window recent andor inprogress uploads appear top instead bottom popup window sort firefox download window putting recent ones bottom requires user scroll see progress bars recent uploads,1
