issuekey,title,description,storypoint
DURACLOUD-4,document logging framework,storeclient whenever used creates directory several directories underneath store log files sending logs stdout default andor documented way changes would good,1
DURACLOUD-10,allow simple updating project version numbers,easysimple update version number parts baseline release,3
DURACLOUD-21,jpegk image conversion service,service wrapper service perform conversion images tiff jpegk,8
DURACLOUD-22,jpegk image server service,service wrapper service serve jpegk images,5
DURACLOUD-23,jpegk image viewer service,service wrapper service display jpegk images,3
DURACLOUD-25,messaging add support durastore methods,add messaging support methods available durastore rest api define appropriate topic heirarchy example uses allows greater degree replication filtering allows replication updatedelete allows creation provenance service,3
DURACLOUD-29,replication bulk existing store newempty store,handles replication content existing storespace new storespace allows starting new replicated store,7
DURACLOUD-39,indexing service spacecontent propertiestags search,includes listening changes spacescontent making calls information included search engine index note needs search engine started available work prior working task choice need made indexing tools used likely candidates aws cloudsearch apache solr various comparisons found assist selection task include updates rest api support users querying index,8
DURACLOUD-41,integrity check demand rely duracloud generated hashes,allow afteringest checksum validation test case use validate replicated content store,13
DURACLOUD-60,allow expected checksum value included adding content item,update durastore rest api call storing content item allow including checksum value compared stored files checksum ensure file received correctly,2
DURACLOUD-61,handle files larger,amazon limits files size many customers want store files larger durastore facilitate handling chunking large files smaller files transfer files need stitched back together download well ideally transparent user even far multiple files appearing one space listing proper total file size,3
DURACLOUD-62,enable paxlogging,use osgi container paxtooling increases important container enables configuration bundlelevel logging resources,2
DURACLOUD-63,production ami continuous integration testing,suite automated tests created run schedule start instances production amis check tabsfieldsbuttons duradmin startverify service verify content actions,5
DURACLOUD-64,update development ami,update tomcat user development ami allow calling aptget via sudo password steps call visudo add line end file tomcat allnopasswdusrbinaptget also add necessary systemproperties enabling servicesutil initialize bundlehome,1
DURACLOUD-66,initialize servicesadmin bundlehome runtime,currently bundlehome buildtime configuration item since deployment machine likely different setup particular build machine would useful allow bundlehome set runtime note avoided past building deployed projects deployment machine solutions may potentially initialize rest call initialize file baked ami initialize system property tempting,1
DURACLOUD-68,integrate viewer duradmin content browse,although viewer currently enabled needs tied duradmin content browse order useful jpeg content,3
DURACLOUD-69,modularize project builds,attempt isolate fundamental aspects baseline terms building testing task create three toplevel pomxml separate storage services infrastructure bamboo builds created run,1
DURACLOUD-70,cannot upload empty content,testing akubraduracloud duracloud trunk noticed anytime attempt send empty stream contentstoreaddcontent behaves though request succeeded exception thrown content item never actually gets created heres ive verified far supports uploading empty items verified via sfox contentstore supports listing getting deleting empty items tested uploading empty item test space using sfox duradmin reports error attempting upload empty file able successfully list get delete empty files,1
DURACLOUD-71,filesystem checksum verifier,utility needs walk directory downloaded books generate checksums file read iamanifest provided checksums bookfilesxml compare generated provided checksums,1
DURACLOUD-74,create emc accounts pilot partner,order allow partners use emc storage pilot need create emc account partner add emc credentials durastore initialization partner,1
DURACLOUD-75,largefile chunking durastore,feature accept large streams coming durastorerestapi chunk duracloud,3
DURACLOUD-76,largefile stitching durastore,feature accept requests large streams coming durastorerestapi stitch duracloudchunks single response stream,3
DURACLOUD-81,update rackspace java library,issues resolved rackspace java library based submitted support tickets current library needs added rackspacestorageprovider needs updated account fixes,1
DURACLOUD-86,limit count space items space metadata,current call get space metadata performs count number items space requires getting list entire set content counting included items large number item space take quite around minutes objects rather performing count every time metadata requested space count capped value returned indicates large number objects example cap counting items value could returned cap reached along cap needs way get actual content count would likely work best clientside count since client would able update display indicate count proceeding,1
DURACLOUD-91,memory error uploading large files duradmin,try uploading three files tomcat throw oom error,2
DURACLOUD-93,convert use slfj consistently logging,currently mix logj commonslogging slfj baseline logj commonslogging dependencies including transitive dependencies need pulled favor slfj good reference point chris wilpers completed task thing fedora baseline,3
DURACLOUD-94,conversion service cleanup always happening,conversion service call add converted file storage fails neither converted file original removed work directory cleanup occur regardless whether conversion upload succeed additionally would good idea add retry upload call,1
DURACLOUD-95,service jars kept service work directory,servicesutil specifically serviceinstallerimplexplodeandinstall service package zip unpacked jars found already deployed placed services work directory instead jar count incremented done already jar ignored,1
DURACLOUD-96,unable add metadata content item metadata name includes space,attempting add metadata content item name metadata includes space add fails failure message metadata added content metadata list issue show adding metadata space update issue resolved amazon rackspace similar problem still exists rackspace metadata added content item metadata name includes space appears work properly refresh item disappear,2
DURACLOUD-97,updating mime type content item invalid mime value causes errors,update mime type content item invalid value imagejpeg exception thrown javalangillegalargumentexception error parsing media type imagejpg item accessed via rest api consequently validation check durastore duradmin make sure value provided mime type acceptable,1
DURACLOUD-98,progress bar uploading content items duradmin,right adding content item,1
DURACLOUD-101,create utility sync duracloud filesystem,used sync arbitrary file system directories duracloud storing new updated files one use case direct backup fedora dspace file content duracloud archive duracloud without needing talk directly see detail,16
DURACLOUD-102,add option set color space image conversion service,nypl images prorgb format need converted srgb part process converting tiff images task include option indicate preferred target colorspace call perform image conversion option need included config item deploying service,2
DURACLOUD-103,ability accountadmin add imagemarkup duradmin home page,goal feature allow duradmin include branding organization using duracloud,1
DURACLOUD-104,handle access control duracloud level rather depending storage providers,access control exists version duracloud handled using acl access mechanisms underlying storage providers allow disallow direct access content items provider stores decided duracloud always mediate content access access control managed within duracloud open space allow anonymous read access content duracloud interfaces whereas closed space allow access authorized users,2
DURACLOUD-106,security add application support transport security ssltls,issue enable baseline handle http requests,8
DURACLOUD-111,video streaming service amazon impl,service expose video content amazons cloudfront streaming server,8
DURACLOUD-114,multithread image conversion service,update image conversion service able spin set threads handle conversion process,2
DURACLOUD-115,image conversion service write output frequently,process reporting image conversion results updated output file created continually updated conversion activity progresses makes possible review results even service running makes results available even service complete properly,2
DURACLOUD-118,stylize logout button,addition security duradmin logout button added baseheaderjsp needs properly formattedstylized,1
DURACLOUD-126,create content retrieval tool,tool complement sync tool command line utility would used pull content duracloud space local file system part activity reconstituting chunked files,4
DURACLOUD-128,anonymous storeclient,contentstoremanagerimpl needs updated allow anonymous users read access content notes skype bill branan primary store queried contentstoreimpl created storageprovidertype storeid could pass storageprovidertypeunknown storeid null addstoreidqueryparameter method would need check null adding query param null param included durastore reads use primary store andrew woods entry point bill branan new public method contentstoremanagerimpl getcontentstoreasanonymous something,1
DURACLOUD-130,investigate sojo dependency,hello danny noticed couple build failures due new dependency duradmin apparently always available hosting maven repository namely netsfsojosojooptionaljar looks like transitive dependency pulled recently netsfspringjsonspringjsonjar would able testing see duradmin actually needs dependency need pull duraspace maven repository since probably runtime dependency ajax tooling could remove local maven repository place exclude element duradmin pomxml run application see actually used anywhere naturally double check local repository make sure slip back thanks andrew planning putting new pageform duradmin allows showingaddingremovingupdating security users initial page baseline could make usable presentable talk length later,1
DURACLOUD-131,update emc libraries reintroduce baseline,emc storage provider currently excluded tests use inconsistent performance around time emc process taking storage service production hopefully addressed problems client libraries emc need updated recent version code needs updated work latest libraries tests use emc provider needs reenabled,2
DURACLOUD-132,application initialization tool,initialization process duracloud becomes increasingly involved tooling support would helpful tool read configuration properties files durastore duraservice duradmin security initialize three webapps set security users three webapps,3
DURACLOUD-133,restful initialization duradmin,currently way initialize duradmin duradmininithtm improvement allow initialization http call,1
DURACLOUD-134,propagate duradmin security updates durastore duraservice,updates security users happens duradmin changes need pushed durastore duraservice,1
DURACLOUD-135,handle xml consistent way throughout duracloud baseline,duracloud currently uses xml many places serveral tools methods used validating parsing xml object model first step pull bit xml generationparsingvalidating code class passing back objects used parts code make easier refactor xml handling standard method consider tools provides best set features use consistently also standard method validation relax considered,5
DURACLOUD-140,error viewing files duradmin space listing,replicate add attached file includes file name space view space using duradmin request appears fail get metadata new file link removed replaced unable complete request status click link disappears everything appears metadata displayed file viewed downloaded note problem appears occur characters show contentid couple questions whats causing failure retrieving metadata link item disappear metadata cant retrieved side note select content item view space page metadata content items loaded content items list turn error messages content page loads shortly things get back normal may appear user done something wrong clicking content link,2
DURACLOUD-143,able embed viewer local hosted application,users would like view jpeg images image server wrapped uiportal images image server would hosted duracloud,1
DURACLOUD-145,duraservice messaging,feature analogous duracloud except calls applying publishing messaging events across duraservice methods,4
DURACLOUD-149,servicesadmin clear registered services,improvement provide restful means clearing registered services servicesadmins cache would facilitate bringing duraservice servicesadmin back sync,3
DURACLOUD-150,duradmin warning overwrite,using duradmin users notified adding content item overwrite existing file,1
DURACLOUD-152,disable unused projects,issue disable duradavwebapp build remove sunstorageprovider,1
DURACLOUD-154,release ami,tracker item container items included ami redirect duradmin,3
DURACLOUD-155,project version batch scripts,issue followon durcloud enabled true project version numbers duracloud baseline issue enable version numbers sourced common bat file ala resourcesscriptsosgienvsh servicesjkservicerundepssh,1
DURACLOUD-156,license boiler plates,going opensource baseline needs updated include proper licensing info,1
DURACLOUD-157,refactor storageproviderfactory taskproviderfactory,order able leverage spring ioc aop etc across classes chain classes follow similar pattern well easily unit test injecting mocks jiraitem refactor classes comprised static methods use spring framework inject respective restjava counterparts,1
DURACLOUD-158,change sync tool default port,default port sync tool allow used customers without set port,1
DURACLOUD-159,provide way make use amazons reduced redundancy storage,amazons reduced redundancy storage provides lower cost cloud storage solution add task set content space use type storage get back standard storage could potentially also add service allow users directly another tracker item,2
DURACLOUD-160,create filebased credential store unit tests,replace current unittestdb filebased method storing retrieving storage provider credentials new method need able handle storage files encrypted developers able keep local file perhaps pointed maven settings includes account credentials needed testing able choose encrypt file working unencrypted file simpler local development using encrypted file allow secure storage simpler sharing among developers key needed encdec could stored maven settings may choose pass encryped credentials file bamboo order able update test accounts keys without needing rebuild ami seems likely reuse code appconfig actually read credentials file assuming format appconfig file also able use encryptionutil common handle encryptiondecryption combination commonsio fileutilsreadfiletostring assembly provides easy cli encrypt decrypt file,3
DURACLOUD-161,transition using reduced redundancy storage pilot storage,transition current objects use rrs update sstorageprovider use rrs default one way would add task sets flag within sstorageprovider indicating preferred storage setting,3
DURACLOUD-163,add config element duraservice serviceregistry store credentials,item add new config element duraservice usernamepassword needed get services dcprod serviceregistry store currently credentials coming hijacked config elements duraserviceservicecomputeusername duraserviceservicecomputepassword,1
DURACLOUD-164,response durastore many open files,uploading files wgbh release instance durastore would respond exception tomcat log files attached indicate javanetsocketexception many open files lsofout shows excess open socket connections instance may related jetst library,3
DURACLOUD-167,error retrieving content stores,getting error trying access spaces duradmin accessing files durastore appears unaffected unexpected error occurred error retrieving content stores response code expected value response body htmlheadtitleapache tomcat error reporttitlestyleh fontfamilytahomaarialsansserifcolorwhitebackgroundcolordfontsizepx fontfamilytahomaarialsansserifcolorwhitebackgroundcolordfontsizepx fontfamilytahomaarialsansserifcolorwhitebackgroundcolordfontsizepx body fontfamilytahomaarialsansserifcolorblackbackgroundcolorwhite fontfamilytahomaarialsansserifcolorwhitebackgroundcolord fontfamilytahomaarialsansserifbackgroundwhitecolorblackfontsizepxa color blackaname color blackhr color dstyle headbodyhhttp status bad credentialshhr size noshadenoshadepbtypeb status reportppbmessageb ubad credentialsuppbdescriptionb uthis request requires http authentication bad credentialsuphr size noshadenoshadehapache tomcathbodyhtmlerror retrieving content stores response code expected value response body htmlheadtitleapache tomcat error reporttitlestyleh fontfamilytahomaarialsansserifcolorwhitebackgroundcolordfontsizepx fontfamilytahomaarialsansserifcolorwhitebackgroundcolordfontsizepx fontfamilytahomaarialsansserifcolorwhitebackgroundcolordfontsizepx body fontfamilytahomaarialsansserifcolorblackbackgroundcolorwhite fontfamilytahomaarialsansserifcolorwhitebackgroundcolord fontfamilytahomaarialsansserifbackgroundwhitecolorblackfontsizepxa color blackaname color blackhr color dstyle headbodyhhttp status bad credentialshhr size noshadenoshadepbtypeb status reportppbmessageb ubad credentialsuppbdescriptionb uthis request requires http authentication bad credentialsuphr size noshadenoshadehapache tomcathbodyhtml,1
DURACLOUD-168,sync tool writes log files working directory,sync tools writes duracloudcommonlog file current working directory possibly issue nonwindows platforms writing relative file path cworkprogramsduracloudlogsduracloudcommonlog causes errors log files caused orgduraclouderrorcontentstoreexception error attempting add content cworkprogramsduracloudlogsduracloudcommonlog aapppreservation due response code expected value response body value error attempting add content cworkprogramsduracloudlogsduracloudcommonlog aapppreservation due content cworkprogramsduracloudlogsduracloudcommonlog added space aapppreservation checksum either provided computed enroute cebadedffe match checksum computed storage provider fbbddbafbbbd content checked retransmitted orgduracloudclientcontentstoreimpladdcontentcontentstoreimpljava orgduracloudchunkwriterduracloudcontentwriteraddcontentduracloudcontentwriterjava caused orgduraclouderrorcontentstoreexception response code expected value response body value error attempting add content cworkprogramsduracloudlogsduracloudcommonlog aapppreservation due content cworkprogramsduracloudlogsduracloudcommonlog added space aapppreservation checksum either provided computed enroute cebadedffe match checksum computed storage provider fbbddbafbbbd content checked retransmitted orgduracloudclientcontentstoreimplcheckresponsecontentstoreimpljava orgduracloudclientcontentstoreimpladdcontentcontentstoreimpljava info poolthread syncworkerjava retryonfailure adding volumesmlamellondiglibbarcodecworkprogramsduracloudlogsduracloudcommonlog back changed list another attempt made sync file mdbarcode chrisbeer java jar downloadssynctooldriverjar wgbhduracloudorg aapppreservation admin changeme starting sync tool startup complete sync tool configuration sync directories volumesmlamellondiglibbarcode durastore host wgbhduracloudorg durastore port durastore username admin duracloud space aapppreservation synctool backup directory synctool poll frequency synctool threads synctool max file size bytes synctool syncing deletes false sync tool help following commands available exits sync tool prints sync tool configuration prints sync tool status level changes log level level may debug info warn error location logs volumesmlamellondiglibbarcodelogs sync tool status start time sync queue size syncs process successful syncs failed syncs volumesmlamellondiglibbarcodecworkprogramsduracloudlogsduracloudcommonlog volumesmlamellondiglibbarcodecworkprogramsduracloudlogsduracloudcommonlog volumesmlamellondiglibbarcodecworkprogramsduracloudlogsduracloudcommonlog quit mdbarcode chrisbeer tail cworkprogramsduracloudlogsduracloudcommonlog logsduracloudcommonlog back changed list another attempt made sync file caused orgduraclouderrorcontentstoreexception error attempting add content cworkprogramsduracloudlogsduracloudcommonlog aapppreservation due response code expected value response body value error attempting add content cworkprogramsduracloudlogsduracloudcommonlog aapppreservation due content cworkprogramsduracloudlogsduracloudcommonlog added space aapppreservation checksum either provided computed enroute cebadedffe match checksum computed storage provider fbbddbafbbbd content checked retransmitted orgduracloudclientcontentstoreimpladdcontentcontentstoreimpljava orgduracloudchunkwriterduracloudcontentwriteraddcontentduracloudcontentwriterjava caused orgduraclouderrorcontentstoreexception response code expected value response body value error attempting add content cworkprogramsduracloudlogsduracloudcommonlog aapppreservation due content cworkprogramsduracloudlogsduracloudcommonlog added space aapppreservation checksum either provided computed enroute cebadedffe match checksum computed storage provider fbbddbafbbbd content checked retransmitted orgduracloudclientcontentstoreimplcheckresponsecontentstoreimpljava orgduracloudclientcontentstoreimpladdcontentcontentstoreimpljava info poolthread syncworkerjava retryonfailure adding volumesmlamellondiglibbarcodecworkprogramsduracloudlogsduracloudcommonlog back changed list another attempt made sync file,1
DURACLOUD-169,noninteractive content transfer tool,complement sync tool love see noninteractive oneoff content transfer tool akin scp rsync either perdirectory perfile could easily integrated existing workflows java jar duracloudtransferjar file wgbhduracloudorg aapppreservation admin changeme transfers file aapppreservation space,1
DURACLOUD-174,errors loading duradmin spaces,syncing large files getting weird intermittent errors duradmin trying verify files answer probably dont reporting anyway url see attached screenshot refreshing attached stack trace eventually get application error orgduracloudduradminutildataretrievalexception orgduraclouderrorcontentstoreexception error attempting get space aapppreservation due many open files javalangruntimeexception orgduracloudduradminutildataretrievalexception orgduraclouderrorcontentstoreexception error attempting get space aapppreservation due many open files orgduracloudduradmincontentstorecontentitemlistgetspacecontentitemlistjava orgduracloudduradmincontrolcontentscontrollerhandlecontentscontrollerjava orgspringframeworkwebservletmvcabstractcommandcontrollerhandlerequestinternalabstractcommandcontrollerjava,1
DURACLOUD-175,break osgi tests new project,move existing service tests spin osgi container new project servicesosgitest tests run normal using mvn clean install skipped dskipinttests pskipinttests flags used,2
DURACLOUD-177,durastore restapi addition spaceexists contentexists,issue add two additional methods durastore restapi spaceexistsspaceid contentexistsspaceid contentid,2
DURACLOUD-178,trade jetst libraries sstorageprovider amazonsupported libraries,use amazon libraries connecting also used connecting,4
DURACLOUD-179,set higher file handle limits duracloud amis,wgbh seen issues instance due tomcat process running file handles get around changes listed bottom ami creation wiki page added changes need included duracloud amis,1
DURACLOUD-180,sync tool run completion,add option sync tool would allow run work queue empty exit would useful administrators would like use sync tool part cron job sync days updates one time rather sync tool run continually,1
DURACLOUD-181,sync tool retry failed transfers,update sync tool write failed transfers file backup directory add option retry failed transfers startup would need one time retry otherwise risk loop high pulls contents failed transfers file work queue clears file new failures would written file,2
DURACLOUD-182,sync tool start scratch option,add option sync tool would clear status logs ignore order start scratch attempt sync files rather restarting would remove need ever manually clear backup directory unless wanting remove log files,1
DURACLOUD-185,change icon something appropriate deployundeploy service,sure lockunlock icons used openclosed spaces really applies service deployundeploy,1
DURACLOUD-191,update image conversion service make use amazons elastic mapreduce service,order handle processing volume data presented pilot partners duracloud needs able distribute compute work onto multiple machines appears standardized way distribution make use apache hadoop since amazon provides elastic mapreduce service makes use hadoop makes sense investigate initial step towards able take advantage scalable processing cloud already data convert nypl tiff images existing image conversion service task allow image conversion run via mapreduce,16
DURACLOUD-192,full url streaming content,improvement expose full url including streaming host server content streamed via mediastreaming service various stream viewers provide ability paste url testing,1
