issuekey,title,description,storypoint
DURACLOUD-584,ensure client tools continue function across minor outages,task test duracloud client tools primarily sync tool retrieval tool make updates necessary allow tools continue run even duracloud instance becomes unavailable short period time period time tested time required upgrade duracloud instance new version allow duracloud users keep tools running even across upgrade cycle likely strategy transfer fails check see instance available retry wait min try instance becomes available resume file transfers,2
DURACLOUD-585,distinguish servicefailures failedserviceresults nonhadoop services,nonhadoop services operate lists items,2
DURACLOUD-586,editing multiple space properties possible users attempt update read spaces,reproduce problem select writeable spacea readonly spaceb using checkboxes click edit properties add tag name value pair save duradmin displays error dialog unauthorized action error,1
DURACLOUD-587,logged nonadmin multispace delete button visible,reproduce log user select space two using checkboxes spaces list confirm delete button visible,1
DURACLOUD-588,verify sdsc storage provider integration,task ensure sdsc storage provider works expected content stored retrieved everything looks sdsc side tests conducted verify duracloud apis work expected executed sdsc provider tests also conducted verify sdsc provider handle storing retrieving large amounts content task requires continuing conversation sdsc folks well direct testing validation,3
DURACLOUD-589,set expiration policies log spaces,task use amazons management console current duracloud accounts set expiration policy xservicework space remove content items logs prefix days,1
DURACLOUD-590,create test bit ami,task test duracloud software bit instance ensure works properly fix problems discovered create production bit ami part release cycle,2
DURACLOUD-591,various duradmin updates,update following items duradmin remove option add one item change add many items link simply add items update image copy button appear consistent buttons currently appears lower quality content detail panel make content size number understandable least include unit bytes content detail panel set buttons color light gray perhaps,1
DURACLOUD-592,duradmin updates,update following items duradmin change space content space name content name respectively footer every duradmin instance page ensure duracloud capitalized footer every duradmin instance page link duracloudorg come duraspaceorg footer every duradmin instance page replace current help desk link help center link points title every duradmin instance page appears browser tab duracloud login duracloud spaces etc something similar duradmin duradmin login duradmin spaces change duracloud administrator duracloud make dashboard tab available root users,1
DURACLOUD-593,duradmin restrict access administration tab,task limit administration tab duradmin viewable root users,1
DURACLOUD-594,move storage reports onto spaces tab,task break information storage reports display instead main spaces tab spacespecific charts included space detail page providerspecific charts displayed detail area currently shown blank selecting spaces tab toplevel allproviders charts longer displayed providerspecific spacespecific charts still provide option view historical charts data,5
DURACLOUD-598,uploading jpg files hashmark file name mimetype accurately identified,reproduce run bulk uploader duradmin select jpg mark filename testjpg select jpg without mark filename testjpg upload files refresh space duradmin verify mimetype testjpg imagejpeg correct verify testjpg applicationoctetstream less correct,1
DURACLOUD-599,uploading bulk upload tool file jpg hashmark file name mimetype accurately identified,reproduce run bulk uploader duradmin select jpg mark filename testjpg select jpg without mark filename testjpg upload files refresh space duradmin verify mimetype testjpg imagejpeg correct verify testjpg applicationoctetstream less correct,1
DURACLOUD-600,release,task run attached spaceacltool production accounts convert spaceaccess properties space acls note running utility convert mode simply creates acls based spaceaccess property want remove legacy spaceaccess properties utility must run remove mode,1
DURACLOUD-602,copy item dialog validation missing destination space info,reproduce admin remove write access spaces within storageprovidera user login select content item click copy select storageprovidera verify destination space drop empty click verify call made despite invalid data optimal solution add default list item space select select destination space display invalid form message item selected,1
DURACLOUD-603,make image thumbnails duradmin larger improve layout,viewing image public space image server service running make thumbnail larger center layout,1
DURACLOUD-604,provide visual feedback slow loading thumbnails image server,image thumbnails generated fly cached djatoka image server latency thumbnail generation sometimes leave user wondering happened image providing visual cue show something happening albeit slowly would improve experience,1
DURACLOUD-605,retrieval tool space error feedback,improvement add user feedback case spaces retrieved inaccessible space exist user access target space retrievaltool output message follows retrieval tool processing complete final status retrieval tool snapshot status start time current time retrievals process successful retrievals change needed failed retrievals order help user understand retrieval work descriptive status message would helpful,1
DURACLOUD-608,issues prefix refresh,part following steps select space items enter prefix type prefix box hit enter click refresh button content item listing causes series error dialogs pop indicating nullpointerexception duradmin attempting count space size stack trace reported dialog captured attached file part following steps selecting space less items causes space detail area screen blink continually,1
DURACLOUD-611,service report link service details,bug seen running service creates output report bitintegritytools generate integrity details space storage provider primary example run service rackspace space service complete select link service details show results notice report found due missing storeidx param,1
DURACLOUD-612,create storage provider,task create storage provider still testing phase allow test new provider easily determine extent meets expectations duracloud application uses openstack code required implementation minimal,1
DURACLOUD-615,integrate shibbolethbased systems,task make possible duradmin integrate existing shibbolethbased authentication authorization systems needed order satisfy requirements internet dfr see discussions related issue,3
DURACLOUD-616,space content checkboxes hard click,trying select set spaces work often select several spaces accidentally deselect accidentally clicking pixels another checkbox solution add padding checkbox element necessary precise mouse position,1
DURACLOUD-617,eventual consistency secondary storageproviders createspace,improvement increase probability space creation method work secondary providers currently sstorageprovider wait cycle createspace method retries adding spacemetadata file bucket created registered similar wait cycle added createspace method rather appropriate setspaceproperties method rackspacestorageprovider azurestorageprovider,1
DURACLOUD-618,add space dialog,task address following bug selecting add space flyout allows entering new space name hitting enter key instead add button popup following error displayed error space undefined,1
DURACLOUD-619,exception space delete,task fix bug causes exception thrown deleting space either duradmin via rest api storageprovider deleting space duradmin popup following message displayed failed delete space looking tomcat log error also shown using rest api cases however space actually deleted,1
DURACLOUD-620,duplicate change spacelevel,improvement update duplicate change service allow configuration spacelevel namely service able run subset total spaces account would ideal improvement also allowed spaces duponchange configured copy primary secondary providers,5
DURACLOUD-621,display bit integrity results space,services automated users longer required run bit integrity service still need know content verified task include likely space details area indication recent successful bit integrity check run content space event recent bit integrity check resulted error duracloud staff need opportunity investigate issue correct possible issue displayed user may also done automated fashion turns error requires user intervention would nice able indicated way calling specifically files need addressed,2
DURACLOUD-622,refactor rackspacestorageprovider openstackstorageprovider,improvement refactor rackspacestorageprovider openstackstorageprovider since currently three storageproviders expose openstack api rackspacestorageprovider coded openstack api abstracted base class three implementations rackspace sdsc inheriting classes names displayed error logging messages,1
DURACLOUD-624,streaming url spaces streamed media streamer,release added ability users select button space turn media streaming space task ensure streaming url provided media streamer service added metadata space streamed user access,1
DURACLOUD-626,media streamer remove viewer space,since services longer run directly users longer need media streamer service produce contents viewer space generated files used part service provided examples user might integrate media streamer service website task add copy generated files updated generic surrounding instructions duracloud documentation update media streamer service longer generate example files,1
DURACLOUD-627,sync retrieval tool encryption support,encryption support added storeclient sync retrieval tools need updated allow user choose enable content encryption supply necessary encryption key,2
DURACLOUD-628,add userid content messaging,improvement include authenticated userid user performing content actions durastore api least userid needs included ingest event message support dfr object creation service,1
DURACLOUD-629,update media streamer service require sources,task remove requirement media streamer service source space,1
DURACLOUD-630,show content manifest head space detail link full manifest,purpose feature guide user content manifest space well enable peek recent activity peek might equivalent head auditlog,2
DURACLOUD-633,snippet generator streaming content,would nice way generate snippet streaming audiovideo embedded directly page,2
DURACLOUD-634,formatting uploadtool space,display spaces tab causes space named uploadtool formatted incorrectly div iduploadtool created space page happens match css entry uploadtool meant div uploadtooljsp turns several space names cause odd behavior reason spaceslistviewresizer footercontent logods particularly strange looking etc strategy making sure kinds name collisions dont happen attached file shows display reacts uploadtool space,1
DURACLOUD-636,executor client,task create java client similar storeclient serviceclient reportclient simplify interactions executor rest api,1
DURACLOUD-637,add manifest client,task create java client calling manifest rest methods duraboss,1
DURACLOUD-638,consolidate duraboss interfaces,improvement refactor executor manifestgenerator auditor interfaces common project shared duraboss various duraboss clients additionally interfaces implemented utilities well clients,1
DURACLOUD-639,make charts zoomable,space pie charts zoomable displaying larger graph overlay,1
DURACLOUD-640,make spaces pie charts navigable,space slices cross spaces pie charts clickable click user navigate time slice space detail history component,2
DURACLOUD-643,executor media streaming,task implement media streaming handler executor design notes found,3
DURACLOUD-644,executor bit integrity checking,task complete bit integrity handler executor design notes found,10
DURACLOUD-646,create auditor client,task create java client similar storeclient serviceclient executorclient simplify interactions auditor rest api,1
DURACLOUD-647,systemusercredential across webapps,improvement create systemusercredential similar rootusercredential created via default usernamepassword overwritten system properties done duradminexecutorimpljava evaluated exchanging rootuser systemuser,1
DURACLOUD-648,merge commonnotification notification project,task move code currently exists commonnotificaton project notification project update made inject amazonnotificationfactory emailnotifier duraboss dependency notificationamazon required notification project part transition implementation classes pushed package orgduracloudnotificationimpl,1
DURACLOUD-650,newly uploaded content items show clicking space,reproduce open space upload content space click space space list notice newly uploaded content showing,1
DURACLOUD-652,add multiple tags spaces content,possible enter multiple tags tag contain spaces let modify enter list space comma separated words get entered separate tags,1
DURACLOUD-653,tag metadata deletes serialized,tag metadata deletes serialized one deletes multiple tagskey value pairs rapid succession youll notice items deleted reappear upon refresh solution use deferreds serialize calls,2
DURACLOUD-655,deselecting content items selected one cause detail pane show space detail,reproduce select content item using checkbox deselect notice space detail pane displayed,1
DURACLOUD-656,checkbox used select items content items list cleared selecting another space,select space select content items select another space notice select check box still checked,1
DURACLOUD-657,refactor revision necessary resolve primary content store every call get space content detail info,probable solution involve caching primary content store client,1
DURACLOUD-658,manifest empty space,currently new space created call ask manifest made response instead response empty manifest list returned could resolved creating space audit log space creation rather addition first content item,1
DURACLOUD-660,chart labels panel resize,reproduce display space make space detail pane wider note line graph labels skewed,1
DURACLOUD-663,secondary provider audit entry sequencing,issue resolve bug occasionally seen content manifest running duponchange sometimes ingest delete messaging events lose sequence secondary provider create scenario item must already exist space deleted immediately reingested common production scenario attached audit log demonstrates case note actual content primary secondary stores actually secondary store show filetxt manifest spaceid contentid manitest filetxt bacdcbd manitest filetxt bacdcbd manitest filetxt bacdcbd manitest filetxt bacdcbd manitest filetxt bacdcbd manitest filetxt bacdcbd manitest filetxt bacdcbd manitest filetxt bacdcbd manitest filetxt bacdcbd,2
DURACLOUD-665,exceptions swallowed javascript space retrieval duradmin,see line spacesmanagerjs notice error handled,1
DURACLOUD-666,enable duradmin run separately instance,see attached error appears problem calling remotely duraservice via duradmin,2
DURACLOUD-667,storage pie charts duradminspaces display file size count totals,add,1
DURACLOUD-668,update duraboss securityconfigxml,task update securityconfigxml file duraboss appropriately cover parts duraboss rest api,1
DURACLOUD-669,update new service plans,new set service plans nailed task make updates necessary make new plans available remove unneeded plans,1
DURACLOUD-672,logback memory leak,improvement determine way allow logback duracloud webapps monitor logbackxml updates without requiring application server cycling create memory leaks memory leak seen redeploying duracloud webapps noticing warnings catalinaout old processes destroyed,2
DURACLOUD-673,sdsc primary storage,task determine feasibility using sdsc duracloud primary store beyond function feasibility performance differences sdsc configuration compared standard configuration side note would interesting explore sdscs openness supporting salted serverside checksums,3
DURACLOUD-674,chronopolis rest server client,feature create java client chronopolis rest server details usage chronopolis client found,3
DURACLOUD-675,chronopolis utility integration,feature leverage chronopolis rest client integrate business tier requesting backups chronopolis restores chronpolis notifications errors completions polling inprocess requests,5
DURACLOUD-676,chronopolis updates,feature integrate ability request backups restores tofrom chronopolis duradmin,2
DURACLOUD-678,display blank size property spaces,size property spaces number bytes stored space always available spaces rackspace information provided never available spaces amazon providers task remove size property space display empty,1
DURACLOUD-680,buttons space content detail wrap,currently viewing duradmin small screen window buttons space detail content detail areas unavailable since horizontal scroll bar obvious additional buttons even exist looking attached screen shot obvious view delete buttons show screen task allow buttons wrap remain available even screen size diminishes,1
DURACLOUD-685,label storage graph axes,improvement add labels two yaxes history byte file counts time storage graphs currently exactly clear lefthand yaxis represents cumulative file size righthand yaxis represents cumulative file counts,1
DURACLOUD-686,itemlevel bitintegrity timestamps,improvement record timestamp itemlevel bitintegrity runs would allow providing green bar bitintegrity health item likely timestamp would persisted bitintegrity runs content lineitem servicegenerated report,1
DURACLOUD-688,bagit manifest two spaces,improvement make sure manifestgenerator bagit manifests delimits checksum path two spaces instead current single space character,1
DURACLOUD-689,toplevel default error page,improvement render default error page apache level example display userfriendly page,1
DURACLOUD-694,duracloud doesnt load using opera internet explorer web browsers,accessing duracloud opera doesnt load properly unusable cannot anything browsers provide result heres summary happens visit using opera login works fine presented screen shows spaces content items looks though content disappeared point theres nothing except logout occurs mac osx windows using opera windows using,1
DURACLOUD-695,bulk upload applet doesnt work hangs multiple browsers,last staff retreat know known issue wanted track scenarios ive discovered thus far bulk upload applet responds following ways loaded following environments mac osx firefox initially saw permanent hang kill firefox continue however restarting firefox second attempt loaded almost immediately mac osx chrome temporary hang mins eventually loads properly mac osx safari loads almost immediately windows chrome loads seconds windows firefox applet never seems load always see blank popup window includes duracloud headerfooter update actually issue java plugin disabled see first comment note internet explorer opera also likely tested duracloud issue resolved,1
DURACLOUD-696,pie charts visible history line graph data point click,admin logged looking space detail pie charts display fold order see user scrolls however user clicks line chart data point pie graphs updated user notice visible would much better history line chart would scroll top container line chart clicked,1
DURACLOUD-697,allow admin change custom logo dragging dropping place,current method replacing xduracloudadminlogo user friendly,2
DURACLOUD-698,back forward browser buttons work spaces manager,reproduce click couple spaces uses browser back button notice back expected,1
DURACLOUD-701,space names,currently using either duradmin durastore rest api directly creating space includes behaves unexpectedly example create space named testxspace shows space listing expected click spaces tab turns testxspace likewise creating similarly named space via durastore rest api cases space shows listing well aws console single would appear transformation happening durastore level task allow durastore permit space names,1
DURACLOUD-702,space count causes bit integrity notice removed,spaces large number content items ajax call made perform count items background number updated space properties count continues eventually set indicate final number space successful bit integrity run notice green background displayed space properties link results bit integrity run situations occur large number items successful bit integrity run completion item count causes space properties reloaded removes notice bit integrity run task ensure bit integrity notice persists item count update,1
DURACLOUD-703,delete space button available user,logged user role space delete button availablevisible clicking delete space error popup window appears states space delete failed ideally person logged user role would unable delete space would easy way delete contents stored within space see attached screenshot error popup window,1
DURACLOUD-704,bit integrity tools service create report empty space,currently bit integrity tools service run space content items indicates link report actually generate report task ensure report generated even content items space,1
DURACLOUD-706,remove image preview,currently image preview section displays icon mountains either image server space publicly viewable tends prompt lots user questions around cannot view preview especially issue multitenant accounts user able start image server make space publicly viewable task remove image preview area content item display,1
DURACLOUD-707,secondary storage providers readonly via rest api,synchronization content storage providers becomes automated duracloud becomes unnecessary users edit content secondary provider order maintain assurance content remains consistent providers ability users make changes secondary storage provider removed would still able view download content addupdatedelete operations would allowed task update rest api ensure users role useradminowner write access secondary stores,3
DURACLOUD-708,image content selection,bug seen quickly clicking content items image mimetypes image within duradmin error presented user,1
DURACLOUD-710,space counting issues,item covers two issues space count occurs space properties spaces items count often starts count used consistently start count completes often restarts performs count second time always ending result,1
DURACLOUD-712,synctool better handle periods time duracloud instance unavailable,update sync tool better able handle periods time instance become unavailable particularly important allow synctool continue run normally across duracloud instance upgrades likely strategy transfer fails check see instance available retry wait min try instance becomes available resume file transfers,2
DURACLOUD-714,display content items names include characters,content item name txt exists space selected content detail display moment act spaces tab selected appears hash period characters need content characters added behavior remains,1
DURACLOUD-715,sdsc auth endpoint,improvement switch authurl found sdscstorageprovider,1
DURACLOUD-716,synctool dryrun,improvement create dryrun flag synctool flag would tell synctool steps determining files synced duracloud including deleted modified content instead actually performing sync report produced detailing content would synced,3
DURACLOUD-717,synctool java sslprotocolexception,java following exception thrown trying use synctool standard configuration exception thread main javalangruntimeexception could create connection durastore due error retrieving content stores handshake alert unrecognizedname issue workaround posted,2
DURACLOUD-720,use mnt instances,improvement leverage mnt instances temp files least varlogtomcat link mnt analysis also performed determine home webapps use mnt well,1
DURACLOUD-721,limit tomcat logs,task update log management settings tomcat server duracloud amis settings contained etclogrotatedtomcat log rotation settings updated rotate size perhaps rather date limit number rotations kept perhaps full list options settings found man logrotate,1
DURACLOUD-723,sync retrieval tool metadata support,task update sync tool retrieval tool able handle content tags metadata duracloud space able pulled local file system using retrieval tool pushed back new duracloud space using sync tool without suffering loss metadata,3
DURACLOUD-724,initializing instance use locally stored services working,performing instance initialization pointing local service repo host longer works issue executor duraboss attempts make calls duraservice initialization gets unauthorized error halts initialization process,1
DURACLOUD-725,audit log space delete,issue audit log xduracloudadmin auditstorageauditlogspacetimetsv detect deleted content entire space deleted scenario create space add content space check content manifest curl userpass note manifest written every seconds may need wait content contained manifest delete content item recheck manifest manifest show deleted item delete space check content manifest bug manifest still shows items space prior space deletion,1
DURACLOUD-726,auditor passing tests windows,auditor project produces many errors test failures built using mvn clean install windows due use colon characters created file names date based file path separator issues,1
DURACLOUD-727,auditor log recreation large spaces failing,auditor action recreate audit logs spaces failing run large sets content seen several instances content within space pushes hundreds thousands items one suggest reason behavior thread used create log may run memory exit,2
DURACLOUD-728,move defaultfilter duradmin common,motivation refactoring make aforementioned useful class available web applications dfrsync,1
