issuekey,title,description,storypoint
DURACLOUD-325,image viewer flyout longer works,past content item image mimetype would present link image thumbnail djatoka service running canned picture icon link would display flyout image viewer clicking thumbnail picture icon effect,1
DURACLOUD-326,duradmin incorrectly displaying space size,using duradmin display spaces larger items space size often misreported even though listing items space also clicking space longer refreshes item listing metadata space also true content items,1
DURACLOUD-327,duradmin delete button misaligned,hovering multiline content item displays delete button halfway current item next item list delete button displayed completely within boundary content item delete,1
DURACLOUD-329,video streaming duradminspaces,item address issue duradmin showing streaming video clicking content item space mediastreamer enabled scenario create two spaces video tmp add file attached jira item space video deploy mediastreamer server using video source tmp destination wait service deployment complete click item video space video shown righthand column point note directly streaming video available,1
DURACLOUD-331,nullpointerexception duplicateonchange service delete content,item address issue npe thrown duplicateonchange service running item deleted monitoring duracloudservicesadminlog show upon action npe thrown orgduracloudservicesreplicationreplicatorreplicatecontentreplicatorjava service successfully remove item secondary store remains alive osgi container however case probably guarded,3
DURACLOUD-332,duplicate change space access propagated,item address issue duplicateondemand service updating access state secondary provider space primary provider changed open closed vice versa scenario deploy duplicateondemand service create space primary store verify space also created secondary store verify spaces access state toggle access state primary space boom notice access state secondary space change,1
DURACLOUD-333,changing space access removes space metadata,changing access level space space metadata removed create space add space metadata change space access refresh space notice space metadata gone,1
DURACLOUD-335,media streamer files getting set proper permissions,occasion starting media streamer service one several files streamed set proper permissions streaming thus far issue always resolved restarting media streamer seems likely missing permission due failed call retry would likely fix problem,1
DURACLOUD-338,chunker tool error pushing files subdirectories windows,running chunker tool windows content directory includes subdirectories files tool attempt send file duracloud name subdirnamefilename causes error character cannot part content show linuxmac systems used instead task update chunker tool replace characters characters generated content ids,1
DURACLOUD-339,duradmin errors space filter,attempting filter name space used xservicework dir example need features get logs specific bulk run tend get next page failed error get space failed error popups filter works loads list filtered content items correctly errors seem unnecessary appears new attempts made get content listing every change filter box letter type creates new call guess adding filter button beside text box making call button pressed would fix issue,1
DURACLOUD-341,duplication demand destination space,configuring duplication demand service leave destination space name blank service automatically create destination space source spaces name carissa ran service leaving destination space blank assuming would occur service ran completion service status read complete duplicated content found,1
DURACLOUD-342,bulk image transformer output standard csv format,currently output bulk image transformer modified csv format similar namevalue namevalue namevalue task update output standard csv format value value value first line file header indicates names values follow name name name bulk bit integrity service produces format allowing hadoop reducer produce value lines using post processor insert name line top,2
DURACLOUD-344,consistency service output destinations names,improvement ensure reportlike outputs services created xserviceout space also outputs consistent naming convention serviceidentifierreportname serviceidentfier lowercase words necessary,4
DURACLOUD-346,refactor integration tests regularly fail,task determine integration tests regularly fail due eventual consistency effects issues related underlying storage provider implementations eventually tests either refactored resistant underlying storage issues refactored unit tests require network connectivity however refactoring work addressed separate task,5
DURACLOUD-347,hashed user credentials,improvement change current pattern storing user credentials inmemory plain text storing hash credentials inmemory authn perform hashing sha see spring security adding passwordencoder authentication providers versions,5
DURACLOUD-348,bulk service status message,improvement accurately display service status state bulk services currently bulk image conversion bulk bit integrity checking processed two steps hadoop processing post processing duracloud instance service status shows conflicting messages job state complete hadoop step done service status shows post job processing bit integrity nothing image conversion accurate consistent status messages need put place across services,2
DURACLOUD-349,bit integrity service iterating http stream,issue change listingiterator found hashfinderworkloadjava iterate cached file inputstream rather content inputstream http get although scenarios issue content stream large lines http stream sometimes breaks causing iteration stop,1
DURACLOUD-351,allow buildtime specification dependency osgi bundle version,improvement allow services built within particular version baseline say specify compatibility dependency duracloudosgi bundles another version say,1
DURACLOUD-352,bit integrity service support comparison space manifests million items,improvement ensure spaces contain million items successfully perform bitintegrity manifest verification,2
DURACLOUD-353,bulk bit integrity service shutdown postprocessor,item address issue shutting bulk bit integrity service undeploy also shutting postprocessor reproduce error start bbis space containing items job state indicates complete service status still indicates post job processing undeploy service undeploy fails due inability remove fixityservice osgi bundle services container still processing point bbis remains duraservice longer available via servicesadmin,2
DURACLOUD-354,bulk image conversion failure due hadoop ami upgrade,item address breakage caused amazon elasticmapreduce changing default ami hadoop jobs effects bulk image conversion service faulting bootstrap script due missing dependency aptget initialization,1
DURACLOUD-355,media streamer allow streaming multiple spaces,task allow user select multiple spaces media streaming service stream,2
DURACLOUD-356,synctool selective syncing,improvement allow user selectively sync specific files based subdirectories prefixes andor suffixes using synctool,3
DURACLOUD-357,media streamer stream files added space,task set listener new files added spaces streaming already enabled enable files streaming well,4
DURACLOUD-358,revisit build source,appears ocj dependency used paxconstruct longer available public repository task revisit pax see upgrade order ensure build works scratch,5
DURACLOUD-364,single use access urls,task allow creation single use access urls user would need specify file would like provide access duracloud would provide link file accessed single time url used longer allows access file,5
DURACLOUD-365,service reports contain another differentiator,service reports appear serviceoutput space need additional differentiator services run multiple times one day overwrite one another,4
DURACLOUD-369,bulk bit integrity service postprocessing hadoop,improvement change bulk bit integrity service run metadata collection postprocessor hadoop instead single process main duracloud instance enables service run within hours instead days spaces exceeding items,3
DURACLOUD-370,notificationemail utility,feature expose utility sending emails consist general interface project corresponding implementation project,2
DURACLOUD-371,remove interim bulkbitintegrity manifests,improvement remove service output space interim manifests bulkbitintegrity service creates final report created manifests bitintegritymetadataresultscsv bitintegrityresultscsv,3
DURACLOUD-374,service report backend utility currently running services,provide way generate report containing details running services details include least following information tbd reports also available retrieval restapi,5
DURACLOUD-375,storage report dashboard,task create dashboard displaying downloading reports storage rest api calls available storage report information gathered need created able display information reports reports likely xml xslt option display,5
DURACLOUD-376,limit time spent spinning mapper task within hadoop,currently service code runs hadoop kicks thread ensure mapper enough time complete threads time limited mapper process hangs hadoop job could potentially live forever task revisit threads bulk jobs set limit amount time threads give mapper activity,2
DURACLOUD-377,remove user management duradmin,task remove usermanagement capabilities adminstration tab duradmin since functionality moved accountmanagementapp,1
DURACLOUD-379,runaway service monitor,task create scriptapplication monitors duracloud accounts longrunning bulk services sends email alert upon detection,1
DURACLOUD-380,azure storage provider adding content specifying checksum,checksum provided upon adding content azure checksuminputstream incorrectly trying calculate checksum provided stream provided checksum used instead calculating stream,1
DURACLOUD-381,duracloud instance losing initialization information,restart duracloud instance via amazon management console wait minutes run appconfig initialize instance check instance everything looks good wait min check time none users init duradmin duraservice steps log duradmin root see admin tab users listed going services tab brings get available services failed error dialog also able log duradmin user besides root interestingly everything seems normal spaces tab rest calls durastore work fine secondary issue step dont wait minutes ahead duradmindurastoreduraservice available less min restart short amount time init less min durastore duraservice init away case users still present,5
DURACLOUD-382,create example serviceclient,task create sample serviceclient analogous sample storeclient,1
DURACLOUD-383,bit integrity service support retries interrupted content downloads,task add retries bitintegrityservice content item downloaded calculate match expected metadata,1
DURACLOUD-384,bit integrity service pass comparison phase contentid csv input,comparison phase allinoneforspace run bitintegrityservice tries guess contentid input csv files datetimestamps appended contentids becomes difficult therefore input contentids passed comparison phase,1
DURACLOUD-385,image viewing url stability,task investigate stability image viewing urls across upgrades duracloud instances duracloud instance allocated static address behavior unexpected specific uses cases demonstrating issue please add comments,2
DURACLOUD-387,error large space delete,item resolve issues seen trying delete large space rackspace storage provider bhlduracloudorg instance space masterrack initially contained items deleting single items page items succeeded however trying delete entire space popup pops minutes indicating operation failed one attempt number items dropped another attempt failing number items dropped looking logs instance appears two different types errors occurring coming rackspace could connect rackspace due error read timed object found reportofscientifscotrichreportofscientifscotrichmetasourcexml contentitems also reported unfound see attached catalinaout details storage provider billduracloudorg instance space numfilestestwork initially contained items clicking delete space duradmin started spinning minutes came back dialog saying failed delete space checking space size dialog popped showed items however even duradmin loop size space continued drop space eventually deleted minutes errors logs indicating failure,5
DURACLOUD-389,service registry naming,update needed support creating serviceconfigxml document named allowable service registry name old convention duracloudservicerepo new convention duracloudservicerepo,1
DURACLOUD-390,security userdetailsservicegetusers,improvement add method security userdetailsservicegetusers limit access call roleadmin,1
DURACLOUD-392,create installation package release,installation package include documentation three wars duradmin duraservice durastore zip service registry zip osgi container,1
DURACLOUD-394,page load latency,duradmin pages built using jquery browser loads scripts pull data building page creating perceptible delay rendering recommended solution may pull jquery back try build screen using much scripting browser versions usage scenarios need added jira item,2
DURACLOUD-397,metadata editor allows blank values,metadata editing via duradmin using regular editor edit metadata dialog allows add empty namevalue pairs metadata list metadata names required although appears allow empty metadata namevalues name empty metadata persist,1
DURACLOUD-398,shortcuts useful disabled,holding shift one arrow keys odd things display shortcuts disabled,1
DURACLOUD-399,allow user select spaces include running duplicate change,task provide option users select list spaces configuring duplicate change service perform duplications items spaces one reason feature allow users choose duplicate xserviceout xservicework spaces,3
DURACLOUD-400,durastore rest api textplain response getspaces,inconsistency noticed looking rest api particular method gives response contenttype header textplain methods return xml declare contenttype textxml example gives textplain gives textxml,1
DURACLOUD-401,use applicationxml response contenttype xmlreturning rest api methods,rest api methods return xml today use textxml applicationxml actually better choice due character encoding issues according specification text media types rfc charset parameter specified declaration mime type end contenttype value ala textxml charsetutf must assumed body encoded usascii encoding declared xml declaration supposed ignored couple online posts explain problem clearly intent duracloud rest api methods return xml encoded utf xml declaration says according standards textxml used instead applicationxml contenttype declared charsetutf mime parameter xml declaration supposed ignored clients assume usascii,1
DURACLOUD-402,allow local service repository,currently required service repository duracloud instance hosted another duracloud instance task allow service repository hosted within instance simplify deployment standalone duracloud instances users open source platform lead way toward allowing multiple service repositories associated single instance,1
DURACLOUD-403,improve binary installation package,release first binary installation package created allows system admins deploy instance duracloud without needing build source good first step pieces could make process smoother include wars names include version jars dropped tomcat release version included file name deployed expected context path rather context path durastore instead durastoreversion installation package zip file includes version number sufficient include appconfig jar needed configure instance include example properties file used appconfigjar instance initialization include defaultexample logbackxml file used within service bundle home update included runbat file properly pick environment variables windows environment allow use local service repository handled duracloud update included readmetxt file complete instructions standing duracloud instance using files provided installation package parts document refer wiki explanation ideally entire process would well enough defined readme links wiki would optional reading,1
DURACLOUD-404,duraservice clean reinitialization,currently reinitializing duraservice due caching elements take new reinitialize values improvement determine implement required make duraservice reinitialization work initialized scratch,1
DURACLOUD-406,servicexml generate build test,improvement servicesxml servicerepo manifest created mvn package phase instead test,1
DURACLOUD-407,servicexml generate various renditions,feature servicesxml servicerepo manifest generated various duracloud account package types archiving preservation media access professional trial,1
DURACLOUD-408,host duracloud maven artifacts sonatype,item includes following tasks open ticket sonatype orgduracloud check deps outside central check dep licenses make sure poms good quality sonatype oss following plugin useful mvn dependencytree,5
DURACLOUD-409,failed copy files running large duplicateondemand service,small percentage files copied execution large duplicate demand service execution result either missing file zero length file target space bug demonstrated repeatedly different providers copies back provider however observed large file sets circa,16
DURACLOUD-410,use amazon multipart upload large files,task update sstorageprovider make use amazons multipart upload option content large enough require chunking would mean rather storing chunked file parts associated manifest would use multipart tools push pieces assemble since entire chunked file available need calculate transfer store metadata,5
DURACLOUD-416,implement content cache mitigate eventual consistency issues,order make issues eventual consistency issue concern users duracloud durastore updated provide cache content stored could mean either storing file locally first making call push provider wrapping stream order write file locally stored provider local files would used fulfill get requests come shortly file stored files cache would removed greater degree certainty file available following requests provider perhaps certain time period elapsed note one benefit storing files locally prior pushing provider would could know file size generate checksum locally making provider request meaning could ensure file reached durastore correctly passing along next location may also become useful handling large files intend pass provider using multipart upload,5
DURACLOUD-420,create ami,updates ami include trim apache rules expect running port add utf support tomcat connectors connector port protocolhttp connectiontimeout redirectport uriencodingutf connector port protocolajp redirectport uriencodingutf add debug tomcat startup script,1
DURACLOUD-423,filter display service properties,feature omit rendering service properties names prefixed system service properties useful monitoring scripting probably confusing endusers duradmin,1
DURACLOUD-424,service completion state must accurate nonbulk services,improvement reflect completion state nonbulk services success failure currently service state remains started affected services bit integrity checker bit integrity checker tools image transformer additionally endtime service captured service properties,3
DURACLOUD-425,service completion state must accurate bulk services,improvement reflect completion state bulk services success failure currently service state remains started affected services bit integrity checker bulk image transformer bulk duplicate demand additionally endtime service captured service properties,2
DURACLOUD-427,wayback machine service,duracloud users storing web archive content warcs wayback machine search access would valuable feature create service reference,8
DURACLOUD-429,irodschronopolis storage adapter,feature add new storage adapter connect irodschronopolis ala rackspace azure base code already provided mike smorul,3
DURACLOUD-430,bulk upload client tool,task create clientside tool provides nice user interface managing bulk upload tasks tool provide allows files uploaded via following methods filedirectory selection dialog progress bar provided indicates status upload specifying file uploaded progress transfer may make sense use synctool background manage file transfers,8
DURACLOUD-431,duradmin mimetype editor applicationatomxml regex,attempting set mimetype content item applicationatomxml error invalid mimetype displayed prohibits setting desired mimetype,1
DURACLOUD-432,file name collisions detected google chrome,using duradmin google chrome upload file file name collision detection popup warning upload simply replaces file using google chrome mac note file name detection popup work firefox,1
DURACLOUD-433,duradmin service status,service deployed via duradmin entry created detailing service hostname status status apparently populated service deployed never updated actual service status changes course processing improvement keep status info entry uptodate pulling content service status property instead deploymentstatus currentaccurate status info also displayed right hand side service details,1
DURACLOUD-435,reinit clear cached storageproviders,upon reinit cached storageproviders cleared order specify different stores,1
DURACLOUD-436,service registry name servicexml dependency,improvement decouple dependency contentid servicexml file service registry spaceid registry currently contentid required identical spaceid addition xml extension servicexml contentid allowed name,2
DURACLOUD-438,add serviceresult completed service properties,improvement add new service property across services completion success failure notes contentid service result file property set upon service completion,1
DURACLOUD-439,enforce space rules services,enforce space rules entering space name duplicate demand service,1
DURACLOUD-440,handle unicode characters storing retrieving content,task ensure content item added retrieved durastore duradmin using characters expressed via unicode generally seems like possible add content items unicode content problems come attempting accessupdatedelete items problems consistent durastore duradmin occationally durastore allows retrieving files duradmin ascii content ids currently fail test list exhaustive examples testitem duradmin cannot load content error accessing via durastore testitem duradmin cannot load content bad request response durastore testitem duradmin cannot load content works fine durastore testitem duradmin cannot even bring metadata works fine durastore course content ids nonascii characters also problems blankhlnjrtxt blank txt seems problem duradmin file retrieved deleted via durastore problem problem duradmin durastore file cannot retrieved deleted via either,5
DURACLOUD-441,servicemanager servicemanager client share interface,improvement following two classes implement interface orgduracloudclientservicesmanagerjava orgduracloudduraservicemgmtservicemanagerjava,1
DURACLOUD-442,change metadata properties,task transition away use term metadata regard namevalue pairs associated duracloud spaces content instead term properties used work involved transitioning two terms throughout baseline,2
DURACLOUD-443,service report create schema serializer servicereportgetcompletedservicesreportlist,task create schema serializer list contentids returned servicereportgetcompletedservicesreportlist expected xml look something like servicereportids servicereportidservicereportxmlservicereportid servicereportids,1
DURACLOUD-444,cumulative storage report,task add additional storage report cumulative ongoing report updated time new storage report completes information report entry completed storage report provides top level report information mime type information would left information detailed report may excluded well goal report able create graphs show change content stored time report could work like completed services report could cycled start new file monthly information included cumulative report allows creation links detailed reports well crosslinks detailed report charts could detailed report content,3
DURACLOUD-445,storageprovider support object copyrename,improvement provide storageprovider interface support copy object stored within durastore another space within storage provider rename object stored within durastore new contentid within existing space three storage providers amazon rackspace azure provider restapi support copy appears amazon azure java clients expose functionality,4
DURACLOUD-446,service reports commadelimited contentids,bug service reports become invalid contentid contains since currently service reports output commadelimited potential solution create tabdelimited service reports,2
DURACLOUD-447,update durareport storage reporting xml generated using jaxb,purpose task swap current xstream implementation durareport storage report generation use jaxb main reason able provide xml schema data generated information easily retrieved used,3
DURACLOUD-450,link service report service properties display,improvement add link services report property display possibly flyout tabular form service results,2
DURACLOUD-451,use different icons service,goal task include different icon beside service deployed services listing available services listing,2
DURACLOUD-452,remove provider dropdown one provider,task remove storage provider dropdown one provider enabled,1
DURACLOUD-453,use different icons content item download view links,task replace button icon content item view link currently download link perhaps eye icon something similar would work,1
DURACLOUD-454,adjust service deployment box remove scroll bars,task readjust popup dialog used deploying services scrolling necessary scroll bars displayed,1
